============================= test session starts ==============================
platform linux -- Python 3.11.13, pytest-8.4.1, pluggy-1.6.0 -- /home/ollie/miniconda3/envs/ptycho311/bin/python3.11
cachedir: .pytest_cache
PyTorch: available
PyTorch version: 2.8.0+cu128
rootdir: /home/ollie/Documents/PtychoPINN2
configfile: pyproject.toml
plugins: anyio-4.9.0
collecting ... collected 452 items / 2 skipped

tests/image/test_cropping.py::TestCroppingAlignment::test_align_for_evaluation_bounding_box PASSED [  0%]
tests/image/test_cropping.py::TestCroppingAlignment::test_align_for_evaluation_coordinates_format PASSED [  0%]
tests/image/test_cropping.py::TestCroppingAlignment::test_align_for_evaluation_shapes PASSED [  0%]
tests/image/test_cropping.py::TestCroppingAlignment::test_align_for_evaluation_with_squeeze PASSED [  0%]
tests/image/test_cropping.py::TestCroppingAlignment::test_center_crop_exact_size PASSED [  1%]
tests/image/test_registration.py::TestRegistration::test_apply_shift_and_crop_basic PASSED [  1%]
tests/image/test_registration.py::TestRegistration::test_apply_shift_and_crop_zero_offset PASSED [  1%]
tests/image/test_registration.py::TestRegistration::test_different_image_content PASSED [  1%]
tests/image/test_registration.py::TestRegistration::test_edge_case_maximum_shift PASSED [  1%]
tests/image/test_registration.py::TestRegistration::test_edge_case_single_pixel_shift PASSED [  2%]
tests/image/test_registration.py::TestRegistration::test_find_offset_known_shift_complex PASSED [  2%]
tests/image/test_registration.py::TestRegistration::test_find_offset_known_shift_real PASSED [  2%]
tests/image/test_registration.py::TestRegistration::test_input_validation_2d_requirement PASSED [  2%]
tests/image/test_registration.py::TestRegistration::test_input_validation_excessive_offset PASSED [  3%]
tests/image/test_registration.py::TestRegistration::test_input_validation_shape_matching PASSED [  3%]
tests/image/test_registration.py::TestRegistration::test_noise_robustness PASSED [  3%]
tests/image/test_registration.py::TestRegistration::test_register_and_align_convenience PASSED [  3%]
tests/image/test_registration.py::TestRegistration::test_registration_sign_verification PASSED [  3%]
tests/image/test_registration.py::TestRegistration::test_round_trip_registration PASSED [  4%]
tests/image/test_registration.py::TestRegistration::test_shift_and_crop_preserves_data_type PASSED [  4%]
tests/io/test_ptychodus_interop_h5.py::test_interop_h5_reader FAILED     [  4%]
tests/io/test_ptychodus_product_io.py::test_export_writes_minimal_hdf5 PASSED [  4%]
tests/io/test_ptychodus_product_io.py::test_import_reads_hdf5_to_rawdata PASSED [  5%]
tests/io/test_ptychodus_product_io.py::test_cli_convert_run1084_smoke PASSED [  5%]
tests/scripts/test_ptychi_reconstruct_tike.py::test_main_uses_cli_arguments PASSED [  5%]
tests/study/test_dose_overlap_comparison.py::test_build_comparison_jobs_creates_all_conditions PASSED [  5%]
tests/study/test_dose_overlap_comparison.py::test_execute_comparison_jobs_invokes_compare_models PASSED [  5%]
tests/study/test_dose_overlap_comparison.py::test_execute_comparison_jobs_records_summary PASSED [  6%]
tests/study/test_dose_overlap_comparison.py::test_build_comparison_jobs_uses_dose_specific_phase_e_paths PASSED [  6%]
tests/study/test_dose_overlap_comparison.py::test_execute_comparison_jobs_appends_tike_recon_path PASSED [  6%]
tests/study/test_dose_overlap_dataset_contract.py::test_validate_dataset_contract_happy_path PASSED [  6%]
tests/study/test_dose_overlap_dataset_contract.py::test_validate_dataset_contract_missing_key PASSED [  7%]
tests/study/test_dose_overlap_dataset_contract.py::test_validate_dataset_contract_wrong_dtype_diffraction PASSED [  7%]
tests/study/test_dose_overlap_dataset_contract.py::test_validate_dataset_contract_wrong_dtype_object PASSED [  7%]
tests/study/test_dose_overlap_dataset_contract.py::test_validate_dataset_contract_shape_mismatch PASSED [  7%]
tests/study/test_dose_overlap_dataset_contract.py::test_validate_dataset_contract_spacing_dense PASSED [  7%]
tests/study/test_dose_overlap_dataset_contract.py::test_validate_dataset_contract_spacing_violation PASSED [  8%]
tests/study/test_dose_overlap_dataset_contract.py::test_validate_dataset_contract_oversampling_precondition_pass PASSED [  8%]
tests/study/test_dose_overlap_dataset_contract.py::test_validate_dataset_contract_oversampling_precondition_fail PASSED [  8%]
tests/study/test_dose_overlap_dataset_contract.py::test_validate_dataset_contract_oversampling_missing_neighbor_count PASSED [  8%]
tests/study/test_dose_overlap_dataset_contract.py::test_validate_dataset_contract_unknown_view PASSED [  9%]
tests/study/test_dose_overlap_design.py::test_study_design_constants PASSED [  9%]
tests/study/test_dose_overlap_design.py::test_study_design_validation PASSED [  9%]
tests/study/test_dose_overlap_design.py::test_study_design_to_dict PASSED [  9%]
tests/study/test_dose_overlap_generation.py::test_build_simulation_plan PASSED [  9%]
tests/study/test_dose_overlap_generation.py::test_generate_dataset_pipeline_orchestration[1000.0] PASSED [ 10%]
tests/study/test_dose_overlap_generation.py::test_generate_dataset_pipeline_orchestration[10000.0] PASSED [ 10%]
tests/study/test_dose_overlap_generation.py::test_generate_dataset_pipeline_orchestration[100000.0] PASSED [ 10%]
tests/study/test_dose_overlap_generation.py::test_generate_dataset_config_construction PASSED [ 10%]
tests/study/test_dose_overlap_generation.py::test_generate_dataset_validates_with_real_contract PASSED [ 11%]
tests/study/test_dose_overlap_generation.py::test_build_simulation_plan_handles_metadata_pickle_guard PASSED [ 11%]
tests/study/test_dose_overlap_generation.py::test_load_data_for_sim_handles_metadata_pickle_guard PASSED [ 11%]
tests/study/test_dose_overlap_generation.py::test_generate_dataset_for_dose_handles_metadata_splits PASSED [ 11%]
tests/study/test_dose_overlap_overlap.py::test_compute_spacing_matrix_basic PASSED [ 11%]
tests/study/test_dose_overlap_overlap.py::test_compute_spacing_matrix_empty PASSED [ 12%]
tests/study/test_dose_overlap_overlap.py::test_compute_spacing_matrix_single PASSED [ 12%]
tests/study/test_dose_overlap_overlap.py::test_spacing_filter_parametrized[sparse-True] PASSED [ 12%]
tests/study/test_dose_overlap_overlap.py::test_spacing_filter_parametrized[dense-False] PASSED [ 12%]
tests/study/test_dose_overlap_overlap.py::test_build_acceptance_mask PASSED [ 13%]
tests/study/test_dose_overlap_overlap.py::test_filter_dataset_by_mask PASSED [ 13%]
tests/study/test_dose_overlap_overlap.py::test_compute_spacing_metrics PASSED [ 13%]
tests/study/test_dose_overlap_overlap.py::test_generate_overlap_views_paths PASSED [ 13%]
tests/study/test_dose_overlap_overlap.py::test_generate_overlap_views_metrics_manifest PASSED [ 13%]
tests/study/test_dose_overlap_overlap.py::test_generate_overlap_views_sparse_downsamples PASSED [ 14%]
tests/study/test_dose_overlap_reconstruction.py::test_build_ptychi_jobs_manifest PASSED [ 14%]
tests/study/test_dose_overlap_reconstruction.py::test_run_ptychi_job_invokes_script PASSED [ 14%]
tests/study/test_dose_overlap_reconstruction.py::test_cli_filters_dry_run PASSED [ 14%]
tests/study/test_dose_overlap_reconstruction.py::test_cli_executes_selected_jobs PASSED [ 15%]
tests/study/test_dose_overlap_reconstruction.py::test_cli_skips_missing_phase_d PASSED [ 15%]
tests/study/test_dose_overlap_training.py::test_build_training_jobs_matrix PASSED [ 15%]
tests/study/test_dose_overlap_training.py::test_run_training_job_invokes_runner PASSED [ 15%]
tests/study/test_dose_overlap_training.py::test_run_training_job_dry_run PASSED [ 15%]
tests/study/test_dose_overlap_training.py::test_execute_training_job_dispatches_tensorflow_by_default PASSED [ 16%]
tests/study/test_dose_overlap_training.py::test_execute_training_job_dispatches_pytorch_when_requested PASSED [ 16%]
tests/study/test_dose_overlap_training.py::test_execute_training_job_tensorflow_persists_bundle PASSED [ 16%]
tests/study/test_dose_overlap_training.py::test_training_cli_filters_jobs PASSED [ 16%]
tests/study/test_dose_overlap_training.py::test_training_cli_manifest_and_bridging PASSED [ 17%]
tests/study/test_dose_overlap_training.py::test_execute_training_job_delegates_to_pytorch_trainer PASSED [ 17%]
tests/study/test_dose_overlap_training.py::test_execute_training_job_persists_bundle PASSED [ 17%]
tests/study/test_dose_overlap_training.py::test_training_cli_invokes_real_runner PASSED [ 17%]
tests/study/test_dose_overlap_training.py::test_build_training_jobs_skips_missing_view PASSED [ 17%]
tests/study/test_dose_overlap_training.py::test_training_cli_records_bundle_path PASSED [ 18%]
tests/study/test_phase_g_dense_artifacts_verifier.py::test_verify_dense_pipeline_artifact_inventory_blocks_missing_entries PASSED [ 18%]
tests/study/test_phase_g_dense_artifacts_verifier.py::test_verify_dense_pipeline_artifact_inventory_passes_with_complete_bundle FAILED [ 18%]
tests/study/test_phase_g_dense_artifacts_verifier.py::test_verify_dense_pipeline_cli_logs_missing PASSED [ 18%]
tests/study/test_phase_g_dense_artifacts_verifier.py::test_verify_dense_pipeline_cli_logs_complete PASSED [ 19%]
tests/study/test_phase_g_dense_artifacts_verifier.py::test_verify_dense_pipeline_cli_phase_logs_missing PASSED [ 19%]
tests/study/test_phase_g_dense_artifacts_verifier.py::test_verify_dense_pipeline_cli_phase_logs_wrong_pattern PASSED [ 19%]
tests/study/test_phase_g_dense_artifacts_verifier.py::test_verify_dense_pipeline_cli_phase_logs_incomplete PASSED [ 19%]
tests/study/test_phase_g_dense_artifacts_verifier.py::test_verify_dense_pipeline_cli_phase_logs_complete PASSED [ 19%]
tests/study/test_phase_g_dense_metrics_report.py::test_report_phase_g_dense_metrics PASSED [ 20%]
tests/study/test_phase_g_dense_metrics_report.py::test_report_phase_g_dense_metrics_missing_model_fails PASSED [ 20%]
tests/study/test_phase_g_dense_metrics_report.py::test_analyze_dense_metrics_flags_failures PASSED [ 20%]
tests/study/test_phase_g_dense_metrics_report.py::test_analyze_dense_metrics_success_digest PASSED [ 20%]
tests/study/test_phase_g_dense_orchestrator.py::test_run_phase_g_dense_collect_only_generates_commands PASSED [ 21%]
tests/study/test_phase_g_dense_orchestrator.py::test_summarize_phase_g_outputs PASSED [ 21%]
tests/study/test_phase_g_dense_orchestrator.py::test_summarize_phase_g_outputs_fails_on_missing_manifest PASSED [ 21%]
tests/study/test_phase_g_dense_orchestrator.py::test_summarize_phase_g_outputs_fails_on_execution_failures PASSED [ 21%]
tests/study/test_phase_g_dense_orchestrator.py::test_summarize_phase_g_outputs_fails_on_missing_csv PASSED [ 21%]
tests/study/test_phase_g_dense_orchestrator.py::test_validate_phase_c_metadata_requires_metadata PASSED [ 22%]
tests/study/test_phase_g_dense_orchestrator.py::test_validate_phase_c_metadata_requires_canonical_transform PASSED [ 22%]
tests/study/test_phase_g_dense_orchestrator.py::test_validate_phase_c_metadata_accepts_valid_metadata PASSED [ 22%]
tests/study/test_phase_g_dense_orchestrator.py::test_validate_phase_c_metadata_handles_patched_layout PASSED [ 22%]
tests/study/test_phase_g_dense_orchestrator.py::test_prepare_hub_detects_stale_outputs PASSED [ 23%]
tests/study/test_phase_g_dense_orchestrator.py::test_prepare_hub_clobbers_previous_outputs PASSED [ 23%]
tests/study/test_phase_g_dense_orchestrator.py::test_run_phase_g_dense_exec_invokes_reporting_helper PASSED [ 23%]
tests/study/test_phase_g_dense_orchestrator.py::test_run_phase_g_dense_exec_prints_highlights_preview PASSED [ 23%]
tests/study/test_phase_g_dense_orchestrator.py::test_run_phase_g_dense_exec_runs_analyze_digest PASSED [ 23%]
tests/test_baselines.py::TestBaselines::test_build_model_always_creates_single_channel_output PASSED [ 24%]
tests/test_cli_args.py::TestCliArgs::test_add_logging_arguments PASSED   [ 24%]
tests/test_cli_args.py::TestCliArgs::test_console_level_choices PASSED   [ 24%]
tests/test_cli_args.py::TestCliArgs::test_get_logging_config_custom_level PASSED [ 24%]
tests/test_cli_args.py::TestCliArgs::test_get_logging_config_defaults PASSED [ 25%]
tests/test_cli_args.py::TestCliArgs::test_get_logging_config_quiet PASSED [ 25%]
tests/test_cli_args.py::TestCliArgs::test_get_logging_config_verbose PASSED [ 25%]
tests/test_cli_args.py::TestCliArgs::test_quiet_verbose_mutually_exclusive PASSED [ 25%]
tests/test_coordinate_grouping.py::TestCoordinateGrouping::test_backward_compatibility PASSED [ 25%]
tests/test_coordinate_grouping.py::TestCoordinateGrouping::test_different_seeds_produce_different_results PASSED [ 26%]
tests/test_coordinate_grouping.py::TestCoordinateGrouping::test_edge_case_k_less_than_c PASSED [ 26%]
tests/test_coordinate_grouping.py::TestCoordinateGrouping::test_edge_case_more_samples_than_points PASSED [ 26%]
tests/test_coordinate_grouping.py::TestCoordinateGrouping::test_edge_case_small_dataset PASSED [ 26%]
tests/test_coordinate_grouping.py::TestCoordinateGrouping::test_efficient_grouping_output_shape PASSED [ 26%]
tests/test_coordinate_grouping.py::TestCoordinateGrouping::test_efficient_grouping_spatial_coherence PASSED [ 27%]
tests/test_coordinate_grouping.py::TestCoordinateGrouping::test_efficient_grouping_valid_indices PASSED [ 27%]
tests/test_coordinate_grouping.py::TestCoordinateGrouping::test_generate_grouped_data_gridsize_1 PASSED [ 27%]
tests/test_coordinate_grouping.py::TestCoordinateGrouping::test_generate_grouped_data_integration PASSED [ 27%]
tests/test_coordinate_grouping.py::TestCoordinateGrouping::test_memory_efficiency PASSED [ 28%]
tests/test_coordinate_grouping.py::TestCoordinateGrouping::test_no_cache_files_created PASSED [ 28%]
tests/test_coordinate_grouping.py::TestCoordinateGrouping::test_performance_improvement PASSED [ 28%]
tests/test_coordinate_grouping.py::TestCoordinateGrouping::test_reproducibility_with_seed PASSED [ 28%]
tests/test_coordinate_grouping.py::TestIntegrationWithExistingCode::test_existing_tests_still_pass PASSED [ 28%]
tests/test_generic_loader.py::TestGenericLoader::test_generic_loader_roundtrip SKIPPED [ 29%]
tests/test_generic_loader.py::test_generic_loader PASSED                 [ 29%]
tests/test_integration_baseline_gs2.py::TestBaselineGridsize2Integration::test_baseline_gridsize2_end_to_end SKIPPED [ 29%]
tests/test_integration_workflow.py::TestFullWorkflow::test_train_save_load_infer_cycle PASSED [ 29%]
tests/test_log_config.py::TestLogConfig::test_backward_compatibility PASSED [ 30%]
tests/test_log_config.py::TestLogConfig::test_conflicting_flags_verbose_overrides PASSED [ 30%]
tests/test_log_config.py::TestLogConfig::test_custom_console_level PASSED [ 30%]
tests/test_log_config.py::TestLogConfig::test_default_setup_logging_creates_log_directory_and_file PASSED [ 30%]
tests/test_log_config.py::TestLogConfig::test_quiet_flag_overrides_console_level PASSED [ 30%]
tests/test_log_config.py::TestLogConfig::test_quiet_mode_disables_console PASSED [ 31%]
tests/test_log_config.py::TestLogConfig::test_setup_logging_clears_existing_handlers PASSED [ 31%]
tests/test_log_config.py::TestLogConfig::test_string_path_support PASSED [ 31%]
tests/test_log_config.py::TestLogConfig::test_verbose_mode_enables_debug_console PASSED [ 31%]
tests/test_misc.py::test_memoize_simulated_data SKIPPED (Deprecated:...) [ 32%]
tests/test_nphotons_metadata_integration.py::TestNphotonsMetadataIntegration::test_configuration_mismatch_warnings PASSED [ 32%]
tests/test_nphotons_metadata_integration.py::TestNphotonsMetadataIntegration::test_end_to_end_workflow_consistency PASSED [ 32%]
tests/test_nphotons_metadata_integration.py::TestNphotonsMetadataIntegration::test_metadata_backward_compatibility PASSED [ 32%]
tests/test_nphotons_metadata_integration.py::TestNphotonsMetadataIntegration::test_metadata_persistence_single_nphotons PASSED [ 32%]
tests/test_nphotons_metadata_integration.py::TestNphotonsMetadataIntegration::test_multiple_nphotons_metadata_consistency PASSED [ 33%]
tests/test_nphotons_metadata_integration.py::TestNphotonsMetadataIntegration::test_training_with_mismatched_config_warns_but_continues PASSED [ 33%]
tests/test_oversampling.py::TestAutomaticOversampling::test_automatic_oversampling_triggers PASSED [ 33%]
tests/test_oversampling.py::TestAutomaticOversampling::test_gridsize_1_no_oversampling PASSED [ 33%]
tests/test_oversampling.py::TestAutomaticOversampling::test_oversampling_with_different_k_values PASSED [ 34%]
tests/test_oversampling.py::TestAutomaticOversampling::test_reproducibility_with_seed PASSED [ 34%]
tests/test_oversampling.py::TestAutomaticOversampling::test_standard_sampling_no_oversampling PASSED [ 34%]
tests/test_projective_warp_xla.py::TestProjectiveWarpXLA::test_batch_processing PASSED [ 34%]
tests/test_projective_warp_xla.py::TestProjectiveWarpXLA::test_complex128_dtype PASSED [ 34%]
tests/test_projective_warp_xla.py::TestProjectiveWarpXLA::test_complex64_dtype PASSED [ 35%]
tests/test_projective_warp_xla.py::TestProjectiveWarpXLA::test_fill_modes PASSED [ 35%]
tests/test_projective_warp_xla.py::TestProjectiveWarpXLA::test_float32_dtype PASSED [ 35%]
tests/test_projective_warp_xla.py::TestProjectiveWarpXLA::test_float64_dtype PASSED [ 35%]
tests/test_projective_warp_xla.py::TestProjectiveWarpXLA::test_float64_with_translation PASSED [ 36%]
tests/test_projective_warp_xla.py::TestProjectiveWarpXLA::test_interpolation_modes PASSED [ 36%]
tests/test_projective_warp_xla.py::TestProjectiveWarpXLA::test_jit_compilation_float32 PASSED [ 36%]
tests/test_projective_warp_xla.py::TestProjectiveWarpXLA::test_jit_compilation_float64 PASSED [ 36%]
tests/test_projective_warp_xla.py::TestProjectiveWarpXLA::test_mixed_precision_translation PASSED [ 36%]
tests/test_projective_warp_xla.py::TestProjectiveWarpXLA::test_tfa_params_conversion PASSED [ 37%]
tests/test_raw_data_grouping.py::TestRawDataGrouping::test_content_validity PASSED [ 37%]
tests/test_raw_data_grouping.py::TestRawDataGrouping::test_edge_case_k_less_than_c PASSED [ 37%]
tests/test_raw_data_grouping.py::TestRawDataGrouping::test_edge_case_more_samples_than_points PASSED [ 37%]
tests/test_raw_data_grouping.py::TestRawDataGrouping::test_edge_case_small_dataset PASSED [ 38%]
tests/test_raw_data_grouping.py::TestRawDataGrouping::test_memory_efficiency PASSED [ 38%]
tests/test_raw_data_grouping.py::TestRawDataGrouping::test_output_shape PASSED [ 38%]
tests/test_raw_data_grouping.py::TestRawDataGrouping::test_performance_improvement PASSED [ 38%]
tests/test_raw_data_grouping.py::TestRawDataGrouping::test_reproducibility PASSED [ 38%]
tests/test_raw_data_grouping.py::TestRawDataGrouping::test_uniform_sampling PASSED [ 39%]
tests/test_scaling_regression.py::TestScalingRegression::test_both_arrays_scaled_identically PASSED [ 39%]
tests/test_scaling_regression.py::TestScalingRegression::test_different_nphotons_produce_proportional_scaling PASSED [ 39%]
tests/test_scaling_regression.py::TestScalingRegression::test_intensity_scale_is_valid PASSED [ 39%]
tests/test_scaling_regression.py::TestScalingRegression::test_phase_is_not_scaled PASSED [ 40%]
tests/test_scaling_regression.py::TestScalingRegression::test_scaling_is_reversible PASSED [ 40%]
tests/test_scaling_regression.py::TestScalingRegression::test_scaling_preserves_physics PASSED [ 40%]
tests/test_scaling_regression.py::TestScalingAssertions::test_assertions_catch_invalid_intensity_scale PASSED [ 40%]
tests/test_sequential_sampling.py::TestSequentialSampling::test_default_behavior_is_random PASSED [ 40%]
tests/test_sequential_sampling.py::TestSequentialSampling::test_sequential_sampling_handles_edge_cases PASSED [ 41%]
tests/test_sequential_sampling.py::TestSequentialSampling::test_sequential_sampling_is_deterministic PASSED [ 41%]
tests/test_sequential_sampling.py::TestSequentialSampling::test_sequential_sampling_order PASSED [ 41%]
tests/test_sequential_sampling.py::TestSequentialSampling::test_sequential_sampling_uses_first_n_points PASSED [ 41%]
tests/test_sequential_sampling.py::TestSequentialSampling::test_sequential_sampling_with_gridsize_greater_than_1 PASSED [ 42%]
tests/test_sequential_sampling.py::TestSequentialSampling::test_sequential_sampling_with_seed_parameter PASSED [ 42%]
tests/test_sequential_sampling.py::TestSequentialSampling::test_sequential_vs_random_coverage PASSED [ 42%]
tests/test_sequential_sampling.py::TestIntegrationWithWorkflow::test_cli_argument_parsing PASSED [ 42%]
tests/test_sequential_sampling.py::TestIntegrationWithWorkflow::test_config_flag_exists PASSED [ 42%]
tests/test_subsampling.py::TestSubsampling::test_different_seeds_produce_different_results PASSED [ 43%]
tests/test_subsampling.py::TestSubsampling::test_interaction_with_config_dataclass PASSED [ 43%]
tests/test_subsampling.py::TestSubsampling::test_legacy_n_images_behavior PASSED [ 43%]
tests/test_subsampling.py::TestSubsampling::test_n_subsample_overrides_n_images PASSED [ 43%]
tests/test_subsampling.py::TestSubsampling::test_no_subsample_uses_full_dataset PASSED [ 44%]
tests/test_subsampling.py::TestSubsampling::test_reproducible_subsampling_with_seed PASSED [ 44%]
tests/test_subsampling.py::TestSubsampling::test_sorted_indices_for_consistency PASSED [ 44%]
tests/test_subsampling.py::TestSubsampling::test_subsample_larger_than_dataset PASSED [ 44%]
tests/test_subsampling.py::TestSubsampling::test_subsample_with_n_subsample PASSED [ 44%]
tests/test_subsampling.py::TestSubsampling::test_subsample_zero_edge_case PASSED [ 45%]
tests/test_subsampling.py::TestSubsampling::test_y_patches_subsampled_consistently PASSED [ 45%]
tests/test_tf_helper.py::TestReassemblePosition::test_basic_functionality PASSED [ 45%]
tests/test_tf_helper.py::TestReassemblePosition::test_different_patch_values_blend PASSED [ 45%]
tests/test_tf_helper.py::TestReassemblePosition::test_identical_patches_single_vs_double PASSED [ 46%]
tests/test_tf_helper.py::TestReassemblePosition::test_perfect_overlap_averages_to_identity PASSED [ 46%]
tests/test_tf_helper.py::TestTranslateFunction::test_batch_translation PASSED [ 46%]
tests/test_tf_helper.py::TestTranslateFunction::test_complex_tensor_translation PASSED [ 46%]
tests/test_tf_helper.py::TestTranslateFunction::test_edge_cases PASSED   [ 46%]
tests/test_tf_helper.py::TestTranslateFunction::test_integer_translation PASSED [ 47%]
tests/test_tf_helper.py::TestTranslateFunction::test_subpixel_translation PASSED [ 47%]
tests/test_tf_helper.py::TestTranslateFunction::test_translate_core_matches_addons SKIPPED [ 47%]
tests/test_tf_helper.py::TestTranslateFunction::test_zero_translation PASSED [ 47%]
tests/test_tf_helper_edge_aware.py::TestTranslateSmoothPatterns::test_complex_smooth_translation PASSED [ 48%]
tests/test_tf_helper_edge_aware.py::TestTranslateSmoothPatterns::test_gaussian_probe_translation SKIPPED [ 48%]
tests/test_tf_helper_edge_aware.py::TestTranslateSmoothPatterns::test_smooth_object_translation SKIPPED [ 48%]
tests/test_tf_helper_edge_aware.py::TestTranslateEdgeCases::test_boundary_behavior SKIPPED [ 48%]
tests/test_tf_helper_edge_aware.py::TestTranslateEdgeCases::test_document_edge_differences SKIPPED [ 48%]
tests/test_tf_helper_edge_aware.py::TestPtychoPINNRelevantCases::test_batch_smooth_patterns SKIPPED [ 49%]
tests/test_tf_helper_edge_aware.py::TestPtychoPINNRelevantCases::test_typical_probe_sizes SKIPPED [ 49%]
tests/test_workflow_components.py::TestLoadInferenceBundle::test_exception_propagation PASSED [ 49%]
tests/test_workflow_components.py::TestLoadInferenceBundle::test_load_valid_model_directory PASSED [ 49%]
tests/test_workflow_components.py::TestLoadInferenceBundle::test_missing_diffraction_model PASSED [ 50%]
tests/test_workflow_components.py::TestLoadInferenceBundle::test_missing_model_archive PASSED [ 50%]
tests/test_workflow_components.py::TestLoadInferenceBundle::test_nonexistent_directory PASSED [ 50%]
tests/test_workflow_components.py::TestLoadInferenceBundle::test_not_a_directory PASSED [ 50%]
tests/test_workflow_components.py::TestLoadInferenceBundle::test_path_conversion PASSED [ 50%]
tests/tools/test_generate_patches_tool.py::test_generate_patches_preserves_metadata PASSED [ 51%]
tests/tools/test_generate_patches_tool.py::test_generate_patches_without_metadata PASSED [ 51%]
tests/tools/test_generate_test_index.py::GenerateTestIndexTests::test_get_module_docstring_handles_missing_docstring PASSED [ 51%]
tests/tools/test_generate_test_index.py::GenerateTestIndexTests::test_get_module_docstring_reads_existing_docstring PASSED [ 51%]
tests/tools/test_generate_test_index.py::GenerateTestIndexTests::test_get_test_functions_lists_key_tests PASSED [ 51%]
tests/tools/test_tail_interleave_logs.py::test_interleave_summaries PASSED [ 52%]
tests/tools/test_transpose_rename_convert_tool.py::test_canonicalize_preserves_metadata PASSED [ 52%]
tests/tools/test_transpose_rename_convert_tool.py::test_canonicalize_without_metadata PASSED [ 52%]
tests/tools/test_update_tool.py::TestUpdateTool::test_update_function PASSED [ 52%]
tests/tools/test_update_tool.py::test_update_function PASSED             [ 53%]
tests/torch/test_api_deprecation.py::TestLegacyAPIDeprecation::test_example_train_import_emits_deprecation_warning PASSED [ 53%]
tests/torch/test_api_deprecation.py::TestLegacyAPIDeprecation::test_api_package_import_is_idempotent PASSED [ 53%]
tests/torch/test_backend_selection.py::TestBackendSelection::test_defaults_to_tensorflow_backend PASSED [ 53%]
tests/torch/test_backend_selection.py::TestBackendSelection::test_selects_pytorch_backend PASSED [ 53%]
tests/torch/test_backend_selection.py::TestBackendSelection::test_pytorch_backend_calls_update_legacy_dict PASSED [ 54%]
tests/torch/test_backend_selection.py::TestBackendSelection::test_pytorch_unavailable_raises_error PASSED [ 54%]
tests/torch/test_backend_selection.py::TestBackendSelection::test_inference_config_supports_backend_selection PASSED [ 54%]
tests/torch/test_backend_selection.py::TestBackendSelection::test_backend_selection_preserves_api_parity PASSED [ 54%]
tests/torch/test_cli_inference_torch.py::TestInferenceCLI::test_accelerator_flag_roundtrip PASSED [ 55%]
tests/torch/test_cli_inference_torch.py::TestInferenceCLI::test_num_workers_flag_roundtrip PASSED [ 55%]
tests/torch/test_cli_inference_torch.py::TestInferenceCLI::test_inference_batch_size_flag_roundtrip PASSED [ 55%]
tests/torch/test_cli_inference_torch.py::TestInferenceCLI::test_multiple_execution_config_flags PASSED [ 55%]
tests/torch/test_cli_inference_torch.py::TestInferenceCLIThinWrapper::test_cli_delegates_to_validate_paths PASSED [ 55%]
tests/torch/test_cli_inference_torch.py::TestInferenceCLIThinWrapper::test_cli_delegates_to_helper_for_data_loading PASSED [ 56%]
tests/torch/test_cli_inference_torch.py::TestInferenceCLIThinWrapper::test_cli_delegates_to_inference_helper PASSED [ 56%]
tests/torch/test_cli_inference_torch.py::TestInferenceCLIThinWrapper::test_cli_calls_save_individual_reconstructions PASSED [ 56%]
tests/torch/test_cli_inference_torch.py::TestInferenceCLIThinWrapper::test_quiet_flag_suppresses_progress_output PASSED [ 56%]
tests/torch/test_cli_shared.py::TestResolveAccelerator::test_default_no_device PASSED [ 57%]
tests/torch/test_cli_shared.py::TestResolveAccelerator::test_legacy_device_cpu PASSED [ 57%]
tests/torch/test_cli_shared.py::TestResolveAccelerator::test_legacy_device_cuda_maps_to_gpu PASSED [ 57%]
tests/torch/test_cli_shared.py::TestResolveAccelerator::test_conflict_accelerator_wins PASSED [ 57%]
tests/torch/test_cli_shared.py::TestResolveAccelerator::test_all_accelerator_values_passthrough PASSED [ 57%]
tests/torch/test_cli_shared.py::TestBuildExecutionConfig::test_training_mode_defaults PASSED [ 58%]
tests/torch/test_cli_shared.py::TestBuildExecutionConfig::test_training_mode_custom_values PASSED [ 58%]
tests/torch/test_cli_shared.py::TestBuildExecutionConfig::test_inference_mode PASSED [ 58%]
tests/torch/test_cli_shared.py::TestBuildExecutionConfig::test_emits_deterministic_warning PASSED [ 58%]
tests/torch/test_cli_shared.py::TestBuildExecutionConfig::test_handles_quiet_flag PASSED [ 59%]
tests/torch/test_cli_shared.py::TestBuildExecutionConfig::test_handles_disable_mlflow_flag PASSED [ 59%]
tests/torch/test_cli_shared.py::TestBuildExecutionConfig::test_quiet_or_disable_mlflow_both_true PASSED [ 59%]
tests/torch/test_cli_shared.py::TestBuildExecutionConfig::test_invalid_mode_raises_value_error PASSED [ 59%]
tests/torch/test_cli_shared.py::TestBuildExecutionConfig::test_resolves_accelerator_from_device_flag PASSED [ 59%]
tests/torch/test_cli_shared.py::TestValidatePaths::test_creates_output_dir PASSED [ 60%]
tests/torch/test_cli_shared.py::TestValidatePaths::test_raises_if_train_file_missing PASSED [ 60%]
tests/torch/test_cli_shared.py::TestValidatePaths::test_raises_if_test_file_missing PASSED [ 60%]
tests/torch/test_cli_shared.py::TestValidatePaths::test_accepts_none_test_file PASSED [ 60%]
tests/torch/test_cli_shared.py::TestValidatePaths::test_works_with_pathlib_path_objects PASSED [ 61%]
tests/torch/test_cli_shared.py::TestValidatePaths::test_accepts_none_train_file_for_inference_mode PASSED [ 61%]
tests/torch/test_cli_shared.py::TestBuildExecutionConfigInferenceMode::test_inference_mode_defaults PASSED [ 61%]
tests/torch/test_cli_shared.py::TestBuildExecutionConfigInferenceMode::test_inference_mode_custom_batch_size PASSED [ 61%]
tests/torch/test_cli_shared.py::TestBuildExecutionConfigInferenceMode::test_inference_mode_respects_quiet PASSED [ 61%]
tests/torch/test_cli_train_torch.py::TestExecutionConfigCLI::test_accelerator_flag_roundtrip PASSED [ 62%]
tests/torch/test_cli_train_torch.py::TestExecutionConfigCLI::test_deterministic_flag_roundtrip PASSED [ 62%]
tests/torch/test_cli_train_torch.py::TestExecutionConfigCLI::test_no_deterministic_flag_roundtrip PASSED [ 62%]
tests/torch/test_cli_train_torch.py::TestExecutionConfigCLI::test_num_workers_flag_roundtrip PASSED [ 62%]
tests/torch/test_cli_train_torch.py::TestExecutionConfigCLI::test_learning_rate_flag_roundtrip PASSED [ 63%]
tests/torch/test_cli_train_torch.py::TestExecutionConfigCLI::test_multiple_execution_config_flags PASSED [ 63%]
tests/torch/test_cli_train_torch.py::TestExecutionConfigCLI::test_bundle_persistence PASSED [ 63%]
tests/torch/test_cli_train_torch.py::TestExecutionConfigCLI::test_enable_checkpointing_flag PASSED [ 63%]
tests/torch/test_cli_train_torch.py::TestExecutionConfigCLI::test_checkpoint_save_top_k_flag PASSED [ 63%]
tests/torch/test_cli_train_torch.py::TestExecutionConfigCLI::test_checkpoint_monitor_flag PASSED [ 64%]
tests/torch/test_cli_train_torch.py::TestExecutionConfigCLI::test_checkpoint_mode_flag PASSED [ 64%]
tests/torch/test_cli_train_torch.py::TestExecutionConfigCLI::test_early_stop_patience_flag PASSED [ 64%]
tests/torch/test_cli_train_torch.py::TestExecutionConfigCLI::test_scheduler_flag_roundtrip PASSED [ 64%]
tests/torch/test_cli_train_torch.py::TestExecutionConfigCLI::test_accumulate_grad_batches_roundtrip PASSED [ 65%]
tests/torch/test_cli_train_torch.py::TestExecutionConfigCLI::test_logger_backend_csv_default PASSED [ 65%]
tests/torch/test_cli_train_torch.py::TestExecutionConfigCLI::test_logger_backend_tensorboard PASSED [ 65%]
tests/torch/test_cli_train_torch.py::TestExecutionConfigCLI::test_logger_backend_none PASSED [ 65%]
tests/torch/test_cli_train_torch.py::TestExecutionConfigCLI::test_disable_mlflow_deprecation_warning PASSED [ 65%]
tests/torch/test_config_bridge.py::TestConfigBridgeMVP::test_mvp_config_bridge_populates_params_cfg PASSED [ 66%]
tests/torch/test_config_bridge.py::TestConfigBridgeParity::test_model_config_direct_fields[N-direct] PASSED [ 66%]
tests/torch/test_config_bridge.py::TestConfigBridgeParity::test_model_config_direct_fields[n_filters_scale-direct] PASSED [ 66%]
tests/torch/test_config_bridge.py::TestConfigBridgeParity::test_model_config_direct_fields[object_big-direct] PASSED [ 66%]
tests/torch/test_config_bridge.py::TestConfigBridgeParity::test_model_config_direct_fields[probe_big-direct] PASSED [ 67%]
tests/torch/test_config_bridge.py::TestConfigBridgeParity::test_training_config_direct_fields[batch_size-direct] PASSED [ 67%]
tests/torch/test_config_bridge.py::TestConfigBridgeParity::test_model_config_transform_fields[gridsize-tuple-to-int] PASSED [ 67%]
tests/torch/test_config_bridge.py::TestConfigBridgeParity::test_model_config_transform_fields[model_type-unsupervised] PASSED [ 67%]
tests/torch/test_config_bridge.py::TestConfigBridgeParity::test_model_config_transform_fields[model_type-supervised] PASSED [ 67%]
tests/torch/test_config_bridge.py::TestConfigBridgeParity::test_model_config_transform_fields[amp_activation-silu] PASSED [ 68%]
tests/torch/test_config_bridge.py::TestConfigBridgeParity::test_model_config_transform_fields[amp_activation-SiLU] PASSED [ 68%]
tests/torch/test_config_bridge.py::TestConfigBridgeParity::test_model_config_transform_fields[amp_activation-passthrough] PASSED [ 68%]
tests/torch/test_config_bridge.py::TestConfigBridgeParity::test_training_config_transform_fields[nepochs-rename] PASSED [ 68%]
tests/torch/test_config_bridge.py::TestConfigBridgeParity::test_training_config_transform_fields[nll_weight-true] PASSED [ 69%]
tests/torch/test_config_bridge.py::TestConfigBridgeParity::test_training_config_transform_fields[nll_weight-false] PASSED [ 69%]
tests/torch/test_config_bridge.py::TestConfigBridgeParity::test_model_config_override_fields[pad_object-default] PASSED [ 69%]
tests/torch/test_config_bridge.py::TestConfigBridgeParity::test_model_config_override_fields[pad_object-override] PASSED [ 69%]
tests/torch/test_config_bridge.py::TestConfigBridgeParity::test_model_config_override_fields[gaussian_smoothing_sigma-default] PASSED [ 69%]
tests/torch/test_config_bridge.py::TestConfigBridgeParity::test_model_config_override_fields[gaussian_smoothing_sigma-override] PASSED [ 70%]
tests/torch/test_config_bridge.py::TestConfigBridgeParity::test_training_config_override_fields[mae_weight-default] PASSED [ 70%]
tests/torch/test_config_bridge.py::TestConfigBridgeParity::test_training_config_override_fields[mae_weight-override] PASSED [ 70%]
tests/torch/test_config_bridge.py::TestConfigBridgeParity::test_training_config_override_fields[realspace_mae_weight-default] PASSED [ 70%]
tests/torch/test_config_bridge.py::TestConfigBridgeParity::test_training_config_override_fields[realspace_weight-default] PASSED [ 71%]
tests/torch/test_config_bridge.py::TestConfigBridgeParity::test_training_config_override_fields[positions_provided-default] PASSED [ 71%]
tests/torch/test_config_bridge.py::TestConfigBridgeParity::test_training_config_override_fields[probe_trainable-default] PASSED [ 71%]
tests/torch/test_config_bridge.py::TestConfigBridgeParity::test_training_config_override_fields[sequential_sampling-default] PASSED [ 71%]
tests/torch/test_config_bridge.py::TestConfigBridgeParity::test_inference_config_override_fields[debug-default] PASSED [ 71%]
tests/torch/test_config_bridge.py::TestConfigBridgeParity::test_inference_config_override_fields[debug-override] PASSED [ 72%]
tests/torch/test_config_bridge.py::TestConfigBridgeParity::test_model_config_probe_mask_translation[probe_mask-default] PASSED [ 72%]
tests/torch/test_config_bridge.py::TestConfigBridgeParity::test_model_config_probe_mask_override PASSED [ 72%]
tests/torch/test_config_bridge.py::TestConfigBridgeParity::test_default_divergence_detection[nphotons-divergence] PASSED [ 72%]
tests/torch/test_config_bridge.py::TestConfigBridgeParity::test_default_divergence_detection[probe_scale-divergence] PASSED [ 73%]
tests/torch/test_config_bridge.py::TestConfigBridgeParity::test_gridsize_error_handling[gridsize-non-square] PASSED [ 73%]
tests/torch/test_config_bridge.py::TestConfigBridgeParity::test_model_type_error_handling[model_type-invalid-enum] PASSED [ 73%]
tests/torch/test_config_bridge.py::TestConfigBridgeParity::test_activation_error_handling[amp_activation-unknown] PASSED [ 73%]
tests/torch/test_config_bridge.py::TestConfigBridgeParity::test_train_data_file_required_error PASSED [ 73%]
tests/torch/test_config_bridge.py::TestConfigBridgeParity::test_model_path_required_error PASSED [ 74%]
tests/torch/test_config_bridge.py::TestConfigBridgeParity::test_nphotons_default_divergence_error PASSED [ 74%]
tests/torch/test_config_bridge.py::TestConfigBridgeParity::test_nphotons_override_passes_validation PASSED [ 74%]
tests/torch/test_config_bridge.py::TestConfigBridgeParity::test_training_config_n_subsample_missing_override_uses_none PASSED [ 74%]
tests/torch/test_config_bridge.py::TestConfigBridgeParity::test_training_config_n_subsample_explicit_override PASSED [ 75%]
tests/torch/test_config_bridge.py::TestConfigBridgeParity::test_inference_config_n_subsample_missing_override_uses_none PASSED [ 75%]
tests/torch/test_config_bridge.py::TestConfigBridgeParity::test_inference_config_n_subsample_explicit_override PASSED [ 75%]
tests/torch/test_config_bridge.py::TestConfigBridgeParity::test_n_groups_missing_override_warning PASSED [ 75%]
tests/torch/test_config_bridge.py::TestConfigBridgeParity::test_test_data_file_training_missing_warning PASSED [ 75%]
tests/torch/test_config_bridge.py::TestConfigBridgeParity::test_params_cfg_matches_baseline PASSED [ 76%]
tests/torch/test_config_factory.py::TestTrainingPayloadStructure::test_training_payload_returns_dataclass PASSED [ 76%]
tests/torch/test_config_factory.py::TestTrainingPayloadStructure::test_training_payload_contains_tf_config PASSED [ 76%]
tests/torch/test_config_factory.py::TestTrainingPayloadStructure::test_training_payload_contains_pytorch_configs PASSED [ 76%]
tests/torch/test_config_factory.py::TestTrainingPayloadStructure::test_training_payload_contains_overrides_dict PASSED [ 76%]
tests/torch/test_config_factory.py::TestTrainingPayloadStructure::test_gridsize_sets_channel_count PASSED [ 77%]
tests/torch/test_config_factory.py::TestInferencePayloadStructure::test_inference_payload_returns_dataclass PASSED [ 77%]
tests/torch/test_config_factory.py::TestInferencePayloadStructure::test_inference_payload_contains_tf_config PASSED [ 77%]
tests/torch/test_config_factory.py::TestInferencePayloadStructure::test_inference_payload_contains_pytorch_configs PASSED [ 77%]
tests/torch/test_config_factory.py::TestConfigBridgeTranslation::test_grid_size_tuple_to_gridsize_int PASSED [ 78%]
tests/torch/test_config_factory.py::TestConfigBridgeTranslation::test_epochs_to_nepochs_conversion PASSED [ 78%]
tests/torch/test_config_factory.py::TestConfigBridgeTranslation::test_k_to_neighbor_count_conversion PASSED [ 78%]
tests/torch/test_config_factory.py::TestLegacyParamsPopulation::test_factory_populates_params_cfg PASSED [ 78%]
tests/torch/test_config_factory.py::TestLegacyParamsPopulation::test_populate_legacy_params_helper PASSED [ 78%]
tests/torch/test_config_factory.py::TestOverridePrecedence::test_override_dict_wins_over_defaults PASSED [ 79%]
tests/torch/test_config_factory.py::TestOverridePrecedence::test_probe_size_override_wins_over_inference PASSED [ 79%]
tests/torch/test_config_factory.py::TestFactoryValidation::test_missing_n_groups_raises_error PASSED [ 79%]
tests/torch/test_config_factory.py::TestFactoryValidation::test_nonexistent_train_data_file_raises_error PASSED [ 79%]
tests/torch/test_config_factory.py::TestFactoryValidation::test_missing_checkpoint_raises_error PASSED [ 80%]
tests/torch/test_config_factory.py::TestExecutionConfigOverrides::test_training_payload_execution_config_not_none PASSED [ 80%]
tests/torch/test_config_factory.py::TestExecutionConfigOverrides::test_inference_payload_execution_config_not_none PASSED [ 80%]
tests/torch/test_config_factory.py::TestExecutionConfigOverrides::test_execution_config_defaults_applied PASSED [ 80%]
tests/torch/test_config_factory.py::TestExecutionConfigOverrides::test_execution_config_explicit_instance_propagates PASSED [ 80%]
tests/torch/test_config_factory.py::TestExecutionConfigOverrides::test_execution_config_fields_accessible PASSED [ 81%]
tests/torch/test_config_factory.py::TestExecutionConfigOverrides::test_overrides_applied_records_execution_knobs PASSED [ 81%]
tests/torch/test_config_factory.py::TestExecutionConfigOverrides::test_checkpoint_knobs_propagate_through_factory PASSED [ 81%]
tests/torch/test_config_factory.py::TestExecutionConfigOverrides::test_checkpoint_defaults_respected PASSED [ 81%]
tests/torch/test_config_factory.py::TestExecutionConfigOverrides::test_scheduler_override_applied PASSED [ 82%]
tests/torch/test_config_factory.py::TestExecutionConfigOverrides::test_accum_steps_override_applied PASSED [ 82%]
tests/torch/test_config_factory.py::TestExecutionConfigOverrides::test_logger_backend_csv_default PASSED [ 82%]
tests/torch/test_config_factory.py::TestExecutionConfigOverrides::test_logger_backend_tensorboard PASSED [ 82%]
tests/torch/test_config_factory.py::TestProbeSizeInference::test_infer_probe_size_from_npz PASSED [ 82%]
tests/torch/test_config_factory.py::TestProbeSizeInference::test_infer_probe_size_missing_file_fallback PASSED [ 83%]
tests/torch/test_data_pipeline.py::TestRawDataTorchAdapter::test_raw_data_torch_matches_tensorflow PASSED [ 83%]
tests/torch/test_data_pipeline.py::TestDataContainerParity::test_data_container_shapes_and_dtypes PASSED [ 83%]
tests/torch/test_data_pipeline.py::TestGroundTruthLoading::test_y_patches_are_complex64 PASSED [ 83%]
tests/torch/test_data_pipeline.py::TestMemmapBridgeParity::test_memmap_loader_matches_raw_data_torch PASSED [ 84%]
tests/torch/test_data_pipeline.py::TestMemmapBridgeParity::test_deterministic_generation_validation PASSED [ 84%]
tests/torch/test_data_pipeline.py::TestMemmapBridgeParity::test_memmap_bridge_accepts_diffraction_legacy PASSED [ 84%]
tests/torch/test_dataloader.py::TestDataloaderCanonicalKeySupport::test_backward_compat_legacy_diff3d PASSED [ 84%]
tests/torch/test_dataloader.py::TestDataloaderCanonicalKeySupport::test_error_when_no_diffraction_key PASSED [ 84%]
tests/torch/test_dataloader.py::TestDataloaderCanonicalKeySupport::test_loads_canonical_diffraction PASSED [ 85%]
tests/torch/test_dataloader.py::TestDataloaderFormatAutoTranspose::test_auto_transposes_legacy_hwn_format PASSED [ 85%]
tests/torch/test_dataloader.py::TestDataloaderFormatAutoTranspose::test_handles_edge_case_square_dataset PASSED [ 85%]
tests/torch/test_dataloader.py::TestDataloaderFormatAutoTranspose::test_npz_headers_also_transposes_shape PASSED [ 85%]
tests/torch/test_dataloader.py::TestDataloaderFormatAutoTranspose::test_preserves_canonical_nwh_format PASSED [ 86%]
tests/torch/test_dataloader.py::TestDataloaderFormatAutoTranspose::test_real_dataset_dimensions PASSED [ 86%]
tests/torch/test_dataloader.py::TestDataloaderFormatAutoTranspose::test_works_with_diff3d_legacy_key PASSED [ 86%]
tests/torch/test_fixture_pytorch_integration.py::TestFixtureContract::test_fixture_file_exists PASSED [ 86%]
tests/torch/test_fixture_pytorch_integration.py::TestFixtureContract::test_fixture_outputs_match_contract PASSED [ 86%]
tests/torch/test_fixture_pytorch_integration.py::TestFixtureContract::test_metadata_sidecar_exists PASSED [ 87%]
tests/torch/test_fixture_pytorch_integration.py::TestFixtureContract::test_metadata_content_valid PASSED [ 87%]
tests/torch/test_fixture_pytorch_integration.py::TestFixtureContract::test_coordinate_coverage PASSED [ 87%]
tests/torch/test_fixture_pytorch_integration.py::TestFixtureIntegrationSmoke::test_fixture_loads_with_rawdata PASSED [ 87%]
tests/torch/test_fixture_pytorch_integration.py::TestFixtureIntegrationSmoke::test_fixture_compatible_with_pytorch_dataloader PASSED [ 88%]
tests/torch/test_integration_workflow_torch.py::test_bundle_loader_returns_modules PASSED [ 88%]
tests/torch/test_integration_workflow_torch.py::test_run_pytorch_train_save_load_infer PASSED [ 88%]
tests/torch/test_integration_workflow_torch.py::TestPyTorchIntegrationWorkflow::test_pytorch_train_save_load_infer_cycle_legacy SKIPPED [ 88%]
tests/torch/test_integration_workflow_torch.py::TestPyTorchIntegrationWorkflow::test_pytorch_tf_output_parity SKIPPED [ 88%]
tests/torch/test_lightning_checkpoint.py::TestLightningCheckpointSerialization::test_checkpoint_contains_hyperparameters PASSED [ 89%]
tests/torch/test_lightning_checkpoint.py::TestLightningCheckpointSerialization::test_load_from_checkpoint_without_kwargs PASSED [ 89%]
tests/torch/test_lightning_checkpoint.py::TestLightningCheckpointSerialization::test_checkpoint_configs_are_serializable PASSED [ 89%]
tests/torch/test_model_manager.py::TestSaveTorchBundle::test_archive_structure PASSED [ 89%]
tests/torch/test_model_manager.py::TestSaveTorchBundle::test_params_snapshot PASSED [ 90%]
tests/torch/test_model_manager.py::TestLoadTorchBundle::test_load_round_trip_updates_params_cfg PASSED [ 90%]
tests/torch/test_model_manager.py::TestLoadTorchBundle::test_missing_params_raises_value_error PASSED [ 90%]
tests/torch/test_model_manager.py::TestLoadTorchBundle::test_load_round_trip_returns_model_stub PASSED [ 90%]
tests/torch/test_model_manager.py::TestLoadTorchBundle::test_reconstructs_models_from_bundle PASSED [ 90%]
tests/torch/test_tf_helper.py::TestTorchTFHelper::test_combine_complex SKIPPED [ 91%]
tests/torch/test_tf_helper.py::TestTorchTFHelper::test_get_mask SKIPPED  [ 91%]
tests/torch/test_tf_helper.py::TestTorchTFHelper::test_placeholder_torch_functions SKIPPED [ 91%]
tests/torch/test_train_probe_size.py::TestNPZProbeSizeExtraction::test_infer_probe_size_128 PASSED [ 91%]
tests/torch/test_train_probe_size.py::TestNPZProbeSizeExtraction::test_infer_probe_size_from_npz PASSED [ 92%]
tests/torch/test_train_probe_size.py::TestNPZProbeSizeExtraction::test_infer_probe_size_missing_probe PASSED [ 92%]
tests/torch/test_train_probe_size.py::TestNPZProbeSizeExtraction::test_infer_probe_size_real_dataset PASSED [ 92%]
tests/torch/test_train_probe_size.py::TestNPZProbeSizeExtraction::test_infer_probe_size_rectangular PASSED [ 92%]
tests/torch/test_workflows_components.py::TestWorkflowsComponentsScaffold::test_run_cdi_example_calls_update_legacy_dict PASSED [ 92%]
tests/torch/test_workflows_components.py::TestWorkflowsComponentsTraining::test_train_cdi_model_torch_invokes_lightning PASSED [ 93%]
tests/torch/test_workflows_components.py::TestWorkflowsComponentsTraining::test_lightning_dataloader_tensor_dict_structure PASSED [ 93%]
tests/torch/test_workflows_components.py::TestWorkflowsComponentsTraining::test_lightning_poisson_count_contract PASSED [ 93%]
tests/torch/test_workflows_components.py::TestWorkflowsComponentsTraining::test_lightning_training_respects_gridsize PASSED [ 93%]
tests/torch/test_workflows_components.py::TestWorkflowsComponentsTraining::test_coords_relative_layout PASSED [ 94%]
tests/torch/test_workflows_components.py::TestWorkflowsComponentsRun::test_run_cdi_example_invokes_training PASSED [ 94%]
tests/torch/test_workflows_components.py::TestWorkflowsComponentsRun::test_run_cdi_example_persists_models PASSED [ 94%]
tests/torch/test_workflows_components.py::TestWorkflowsComponentsRun::test_load_inference_bundle_handles_bundle PASSED [ 94%]
tests/torch/test_workflows_components.py::TestTrainWithLightningRed::test_train_with_lightning_instantiates_module PASSED [ 94%]
tests/torch/test_workflows_components.py::TestTrainWithLightningRed::test_train_with_lightning_runs_trainer_fit PASSED [ 95%]
tests/torch/test_workflows_components.py::TestTrainWithLightningRed::test_train_with_lightning_returns_models_dict PASSED [ 95%]
tests/torch/test_workflows_components.py::TestReassembleCdiImageTorchGreen::test_reassemble_cdi_image_torch_guard_without_train_results PASSED [ 95%]
tests/torch/test_workflows_components.py::TestReassembleCdiImageTorchGreen::test_reassemble_cdi_image_torch_flip_transpose_contract[False-False-False] PASSED [ 95%]
tests/torch/test_workflows_components.py::TestReassembleCdiImageTorchGreen::test_reassemble_cdi_image_torch_flip_transpose_contract[True-False-False] PASSED [ 96%]
tests/torch/test_workflows_components.py::TestReassembleCdiImageTorchGreen::test_reassemble_cdi_image_torch_flip_transpose_contract[False-True-False] PASSED [ 96%]
tests/torch/test_workflows_components.py::TestReassembleCdiImageTorchGreen::test_reassemble_cdi_image_torch_flip_transpose_contract[False-False-True] PASSED [ 96%]
tests/torch/test_workflows_components.py::TestReassembleCdiImageTorchGreen::test_reassemble_cdi_image_torch_flip_transpose_contract[True-True-True] PASSED [ 96%]
tests/torch/test_workflows_components.py::TestReassembleCdiImageTorchGreen::test_run_cdi_example_torch_do_stitching_delegates_to_reassemble PASSED [ 96%]
tests/torch/test_workflows_components.py::TestReassembleCdiImageTorchGreen::test_reassemble_cdi_image_torch_return_contract PASSED [ 97%]
tests/torch/test_workflows_components.py::TestReassembleCdiImageTorchFloat32::test_batches_remain_float32 PASSED [ 97%]
tests/torch/test_workflows_components.py::TestReassembleCdiImageTorchFloat32::test_dataloader_casts_float64_to_float32 PASSED [ 97%]
tests/torch/test_workflows_components.py::TestDecoderLastShapeParity::test_probe_big_shape_alignment PASSED [ 97%]
tests/torch/test_workflows_components.py::TestDecoderLastShapeParity::test_probe_big_false_no_mismatch PASSED [ 98%]
tests/torch/test_workflows_components.py::TestTrainWithLightningGreen::test_execution_config_overrides_trainer PASSED [ 98%]
tests/torch/test_workflows_components.py::TestTrainWithLightningGreen::test_execution_config_controls_determinism PASSED [ 98%]
tests/torch/test_workflows_components.py::TestInferenceExecutionConfig::test_inference_uses_execution_batch_size PASSED [ 98%]
tests/torch/test_workflows_components.py::TestLightningCheckpointCallbacks::test_model_checkpoint_callback_configured PASSED [ 98%]
tests/torch/test_workflows_components.py::TestLightningCheckpointCallbacks::test_early_stopping_callback_configured PASSED [ 99%]
tests/torch/test_workflows_components.py::TestLightningCheckpointCallbacks::test_disable_checkpointing_skips_callbacks PASSED [ 99%]
tests/torch/test_workflows_components.py::TestLightningExecutionConfig::test_trainer_receives_accumulation PASSED [ 99%]
tests/torch/test_workflows_components.py::TestLightningExecutionConfig::test_monitor_uses_val_loss_name PASSED [ 99%]
tests/torch/test_workflows_components.py::TestLightningExecutionConfig::test_trainer_receives_logger PASSED [100%]

=================================== FAILURES ===================================
____________________________ test_interop_h5_reader ____________________________

tmp_path = PosixPath('/tmp/pytest-of-ollie/pytest-512/test_interop_h5_reader0')

    def test_interop_h5_reader(tmp_path: Path):
        # Export a minimal product file using our exporter
        raw = _stub_raw()
        meta = ExportMeta(
            name="InteropTest",
            comments="interop smoke",
            detector_distance_m=0.5,
            probe_energy_eV=9000.0,
            exposure_time_s=0.2,
            object_pixel_width_m=5.0e-8,
            object_pixel_height_m=5.0e-8,
            probe_pixel_width_m=1.25e-7,
            probe_pixel_height_m=1.25e-7,
            object_center_x_m=0.0,
            object_center_y_m=0.0,
        )
        out = tmp_path / "interop.h5"
        export_product_from_rawdata(raw, out, meta)
    
        # Ensure ptychodus/src is importable so we can use its HDF5 reader plugin
        proj_root = Path(__file__).resolve().parents[2]
        sys.path.insert(0, str(proj_root / "ptychodus" / "src"))
    
>       from ptychodus.plugins.h5_product_file import H5ProductFileIO
E       ModuleNotFoundError: No module named 'ptychodus'

tests/io/test_ptychodus_interop_h5.py:49: ModuleNotFoundError
__ test_verify_dense_pipeline_artifact_inventory_passes_with_complete_bundle ___

tmp_path = PosixPath('/tmp/pytest-of-ollie/pytest-512/test_verify_dense_pipeline_art1')

    def test_verify_dense_pipeline_artifact_inventory_passes_with_complete_bundle(tmp_path: Path) -> None:
        """
        Test that verify_dense_pipeline_artifacts.py succeeds when artifact_inventory.txt
        is present and properly formatted.
    
        Acceptance:
        - Create a complete hub with all required artifacts including artifact_inventory.txt
        - artifact_inventory.txt must contain POSIX-relative paths (no absolute paths, no backslashes)
        - Invoke verify_dense_pipeline_artifacts.py --hub <hub> --report <report>
        - Assert the script exits with status 0
        - Assert the verification report JSON shows all_valid=True
        - Assert the artifact_inventory validation check passes
    
        Follows TYPE-PATH-001 (Path normalization).
        """
        # Setup: Create complete hub
        hub = tmp_path / "complete_hub"
        analysis = hub / "analysis"
        analysis.mkdir(parents=True)
        cli_dir = hub / "cli"
        cli_dir.mkdir(parents=True)
    
        # Create all required artifacts
        metrics_summary = {
            "n_jobs": 6,
            "n_success": 6,
            "n_failed": 0,
            "aggregate_metrics": {
                "PtychoPINN": {"ms_ssim": {"amplitude": 0.95, "phase": 0.92}, "mae": {"amplitude": 0.05, "phase": 0.08}},
                "Baseline": {"ms_ssim": {"amplitude": 0.90, "phase": 0.87}, "mae": {"amplitude": 0.10, "phase": 0.13}},
                "PtyChi": {"ms_ssim": {"amplitude": 0.88, "phase": 0.85}, "mae": {"amplitude": 0.12, "phase": 0.15}},
            },
            "phase_c_metadata_compliance": {
                "dose_1000": {"train": {"compliant": True}, "test": {"compliant": True}},
            }
        }
        (analysis / "metrics_summary.json").write_text(json.dumps(metrics_summary))
    
        (analysis / "comparison_manifest.json").write_text(json.dumps({
            "n_jobs": 6,
            "n_success": 6,
            "n_failed": 0,
            "jobs": []
        }))
    
        (analysis / "metrics_summary.md").write_text("# Metrics Summary\n\nFake summary\n")
        (analysis / "aggregate_highlights.txt").write_text("Fake highlights\n")
    
        digest_content = """# Phase G Dense Metrics Digest
    
    ## Pipeline Summary
    
    Completed successfully.
    
    ## Highlights
    
    MS-SSIM improvements observed.
    """
        (analysis / "metrics_digest.md").write_text(digest_content)
    
        # Create metrics delta artifacts
        delta_summary = {
            "generated_at": "2025-11-10T10:00:00Z",
            "source_metrics": "analysis/metrics_summary.json",
            "deltas": {
                "vs_Baseline": {
                    "ms_ssim": {"amplitude": 0.05, "phase": 0.05},
                    "mae": {"amplitude": -0.05, "phase": -0.05}
                },
                "vs_PtyChi": {
                    "ms_ssim": {"amplitude": 0.07, "phase": 0.07},
                    "mae": {"amplitude": -0.07, "phase": -0.07}
                }
            }
        }
        (analysis / "metrics_delta_summary.json").write_text(json.dumps(delta_summary))
    
        highlights_txt = """MS-SSIM  (PtychoPINN - Baseline) Amplitude: +0.05, Phase: +0.05
    MS-SSIM  (PtychoPINN - PtyChi) Amplitude: +0.07, Phase: +0.07
    MAE  (PtychoPINN - Baseline) Amplitude: -0.05, Phase: -0.05
    MAE  (PtychoPINN - PtyChi) Amplitude: -0.07, Phase: -0.07
    """
        (analysis / "metrics_delta_highlights.txt").write_text(highlights_txt)
    
        # Create artifact_inventory.txt with POSIX-relative paths
        inventory_content = """analysis/aggregate_highlights.txt
    analysis/comparison_manifest.json
    analysis/metrics_delta_highlights.txt
    analysis/metrics_delta_summary.json
    analysis/metrics_digest.md
    analysis/metrics_summary.json
    analysis/metrics_summary.md
    cli/run_phase_g_dense.log
    """
        (analysis / "artifact_inventory.txt").write_text(inventory_content)
    
        # Create orchestrator CLI log with all required elements
        orchestrator_log_content = """[run_phase_g_dense] Starting pipeline...
    ================================================================================
    [1/8] Phase C: Dataset Generation
    ================================================================================
    Running Phase C...
    ================================================================================
    [2/8] Phase D: Overlap View Generation
    ================================================================================
    Running Phase D...
    ================================================================================
    [3/8] Phase E: Training Baseline (gs1)
    ================================================================================
    Running baseline...
    ================================================================================
    [4/8] Phase E: Training Dense (gs2)
    ================================================================================
    Running dense...
    ================================================================================
    [5/8] Phase F: Reconstruction dense/train
    ================================================================================
    Reconstruction train...
    ================================================================================
    [6/8] Phase F: Reconstruction dense/test
    ================================================================================
    Reconstruction test...
    ================================================================================
    [7/8] Phase G: Comparison dense/train
    ================================================================================
    Comparison train...
    ================================================================================
    [8/8] Phase G: Comparison dense/test
    ================================================================================
    Comparison test...
    ================================================================================
    [run_phase_g_dense] SUCCESS: All phases completed
    ================================================================================
    """
        (cli_dir / "run_phase_g_dense.log").write_text(orchestrator_log_content)
    
        # Create all required per-phase logs (requirement added in TDD cycle for per-phase log validation)
        phase_logs = {
            "phase_c_generation.log": "Phase C generation complete\n",
            "phase_d_dense.log": "Phase D overlap view generation complete\n",
            "phase_e_baseline.log": "Phase E baseline training complete\n",
            "phase_e_dense.log": "Phase E dense training complete\n",
            "phase_f_train.log": "Phase F train reconstruction complete\n",
            "phase_f_test.log": "Phase F test reconstruction complete\n",
            "phase_g_train.log": "Phase G train comparison complete\n",
            "phase_g_test.log": "Phase G test comparison complete\n",
        }
    
        for log_name, content in phase_logs.items():
            (cli_dir / log_name).write_text(f"# {log_name}\n{content}")
    
        report_path = tmp_path / "report_complete.json"
    
        # Execute: Import and run the verifier
        import sys
        import importlib.util
    
        verifier_script = Path(__file__).parent.parent.parent / "plans" / "active" / \
                          "STUDY-SYNTH-FLY64-DOSE-OVERLAP-001" / "bin" / "verify_dense_pipeline_artifacts.py"
    
        spec = importlib.util.spec_from_file_location("verifier", verifier_script)
        verifier = importlib.util.module_from_spec(spec)
    
        # Monkeypatch sys.argv
        original_argv = sys.argv
        sys.argv = [
            str(verifier_script),
            "--hub", str(hub),
            "--report", str(report_path),
        ]
    
        try:
            spec.loader.exec_module(verifier)
            exit_code = verifier.main()
        except SystemExit as e:
            exit_code = e.code
        finally:
            sys.argv = original_argv
    
        # Assert: Verification succeeded
>       assert exit_code == 0, f"Expected exit code 0 with complete bundle, got {exit_code}"
E       AssertionError: Expected exit code 0 with complete bundle, got 1
E       assert 1 == 0

tests/study/test_phase_g_dense_artifacts_verifier.py:289: AssertionError
----------------------------- Captured stdout call -----------------------------
[verify_dense_pipeline_artifacts] Hub: /tmp/pytest-of-ollie/pytest-512/test_verify_dense_pipeline_art1/complete_hub
[verify_dense_pipeline_artifacts] Report: /tmp/pytest-of-ollie/pytest-512/test_verify_dense_pipeline_art1/report_complete.json

[verify_dense_pipeline_artifacts] Verification Summary:
  Total checks: 10
  Valid: 9
  Invalid: 1
  Report: /tmp/pytest-of-ollie/pytest-512/test_verify_dense_pipeline_art1/report_complete.json

[verify_dense_pipeline_artifacts] FAILURES:
   CLI orchestrator logs validation: Missing required per-phase log files: phase_e_baseline_gs1_dose1000.log, phase_e_dense_gs2_dose1000.log, phase_f_dense_train.log, phase_f_dense_test.log, phase_g_dense_train.log, phase_g_dense_test.log
=============================== warnings summary ===============================
tests/torch/test_cli_train_torch.py::TestExecutionConfigCLI::test_num_workers_flag_roundtrip
  /home/ollie/Documents/PtychoPINN2/ptycho_torch/train.py:652: UserWarning: Deterministic mode with num_workers=4 may cause performance degradation. Consider setting --num-workers 0 for reproducibility.
    execution_config = build_execution_config_from_args(args, mode='training')

tests/torch/test_cli_train_torch.py::TestExecutionConfigCLI::test_bundle_persistence
  /home/ollie/Documents/PtychoPINN2/ptycho_torch/config_factory.py:552: UserWarning: Error reading probeGuess from /tmp/pytest-of-ollie/pytest-512/test_bundle_persistence0/train.npz: No data left in file. Using fallback N=64.
    warnings.warn(

tests/torch/test_cli_train_torch.py: 1 warning
tests/torch/test_config_factory.py: 22 warnings
tests/torch/test_workflows_components.py: 12 warnings
  /home/ollie/Documents/PtychoPINN2/ptycho_torch/config_factory.py:257: UserWarning: test_data_file not provided in TrainingConfig overrides. Evaluation workflows require test_data_file to be set during inference update. Consider providing: overrides=dict(..., test_data_file=Path('test.npz'))
    tf_training_config = to_training_config(

tests/torch/test_cli_train_torch.py: 1 warning
tests/torch/test_config_factory.py: 25 warnings
tests/torch/test_workflows_components.py: 12 warnings
  /home/ollie/Documents/PtychoPINN2/ptycho_torch/config_factory.py:613: UserWarning: params.cfg already populated. Set force=True to overwrite existing values.
    warnings.warn(

tests/torch/test_config_bridge.py::TestConfigBridgeMVP::test_mvp_config_bridge_populates_params_cfg
  /home/ollie/Documents/PtychoPINN2/tests/torch/test_config_bridge.py:100: UserWarning: test_data_file not provided in TrainingConfig overrides. Evaluation workflows require test_data_file to be set during inference update. Consider providing: overrides=dict(..., test_data_file=Path('test.npz'))
    spec_train = config_bridge.to_training_config(

tests/torch/test_config_bridge.py::TestConfigBridgeParity::test_training_config_direct_fields[batch_size-direct]
  /home/ollie/Documents/PtychoPINN2/tests/torch/test_config_bridge.py:235: UserWarning: test_data_file not provided in TrainingConfig overrides. Evaluation workflows require test_data_file to be set during inference update. Consider providing: overrides=dict(..., test_data_file=Path('test.npz'))
    tf_train = config_bridge.to_training_config(

tests/torch/test_config_bridge.py::TestConfigBridgeParity::test_training_config_transform_fields[nepochs-rename]
tests/torch/test_config_bridge.py::TestConfigBridgeParity::test_training_config_transform_fields[nll_weight-true]
tests/torch/test_config_bridge.py::TestConfigBridgeParity::test_training_config_transform_fields[nll_weight-false]
  /home/ollie/Documents/PtychoPINN2/tests/torch/test_config_bridge.py:298: UserWarning: test_data_file not provided in TrainingConfig overrides. Evaluation workflows require test_data_file to be set during inference update. Consider providing: overrides=dict(..., test_data_file=Path('test.npz'))
    tf_train = config_bridge.to_training_config(

tests/torch/test_config_bridge.py::TestConfigBridgeParity::test_training_config_override_fields[mae_weight-default]
tests/torch/test_config_bridge.py::TestConfigBridgeParity::test_training_config_override_fields[mae_weight-override]
tests/torch/test_config_bridge.py::TestConfigBridgeParity::test_training_config_override_fields[realspace_mae_weight-default]
tests/torch/test_config_bridge.py::TestConfigBridgeParity::test_training_config_override_fields[realspace_weight-default]
tests/torch/test_config_bridge.py::TestConfigBridgeParity::test_training_config_override_fields[positions_provided-default]
tests/torch/test_config_bridge.py::TestConfigBridgeParity::test_training_config_override_fields[probe_trainable-default]
tests/torch/test_config_bridge.py::TestConfigBridgeParity::test_training_config_override_fields[sequential_sampling-default]
  /home/ollie/Documents/PtychoPINN2/tests/torch/test_config_bridge.py:366: UserWarning: test_data_file not provided in TrainingConfig overrides. Evaluation workflows require test_data_file to be set during inference update. Consider providing: overrides=dict(..., test_data_file=Path('test.npz'))
    tf_train = config_bridge.to_training_config(

tests/torch/test_config_bridge.py::TestConfigBridgeParity::test_default_divergence_detection[nphotons-divergence]
  /home/ollie/Documents/PtychoPINN2/tests/torch/test_config_bridge.py:493: UserWarning: test_data_file not provided in TrainingConfig overrides. Evaluation workflows require test_data_file to be set during inference update. Consider providing: overrides=dict(..., test_data_file=Path('test.npz'))
    tf_train = config_bridge.to_training_config(

tests/torch/test_config_bridge.py::TestConfigBridgeParity::test_train_data_file_required_error
  /home/ollie/Documents/PtychoPINN2/tests/torch/test_config_bridge.py:575: UserWarning: test_data_file not provided in TrainingConfig overrides. Evaluation workflows require test_data_file to be set during inference update. Consider providing: overrides=dict(..., test_data_file=Path('test.npz'))
    config_bridge.to_training_config(

tests/torch/test_config_bridge.py::TestConfigBridgeParity::test_nphotons_override_passes_validation
  /home/ollie/Documents/PtychoPINN2/tests/torch/test_config_bridge.py:666: UserWarning: test_data_file not provided in TrainingConfig overrides. Evaluation workflows require test_data_file to be set during inference update. Consider providing: overrides=dict(..., test_data_file=Path('test.npz'))
    tf_train = config_bridge.to_training_config(

tests/torch/test_config_bridge.py::TestConfigBridgeParity::test_training_config_n_subsample_missing_override_uses_none
  /home/ollie/Documents/PtychoPINN2/tests/torch/test_config_bridge.py:707: UserWarning: test_data_file not provided in TrainingConfig overrides. Evaluation workflows require test_data_file to be set during inference update. Consider providing: overrides=dict(..., test_data_file=Path('test.npz'))
    tf_train = config_bridge.to_training_config(

tests/torch/test_config_bridge.py::TestConfigBridgeParity::test_training_config_n_subsample_explicit_override
  /home/ollie/Documents/PtychoPINN2/tests/torch/test_config_bridge.py:742: UserWarning: test_data_file not provided in TrainingConfig overrides. Evaluation workflows require test_data_file to be set during inference update. Consider providing: overrides=dict(..., test_data_file=Path('test.npz'))
    tf_train = config_bridge.to_training_config(

tests/torch/test_config_factory.py::TestProbeSizeInference::test_infer_probe_size_missing_file_fallback
  /home/ollie/Documents/PtychoPINN2/ptycho_torch/config_factory.py:546: UserWarning: Data file /nonexistent/data.npz not found. Using fallback N=64.
    warnings.warn(

tests/torch/test_lightning_checkpoint.py::TestLightningCheckpointSerialization::test_checkpoint_contains_hyperparameters
tests/torch/test_lightning_checkpoint.py::TestLightningCheckpointSerialization::test_load_from_checkpoint_without_kwargs
tests/torch/test_lightning_checkpoint.py::TestLightningCheckpointSerialization::test_checkpoint_configs_are_serializable
tests/torch/test_workflows_components.py::TestWorkflowsComponentsTraining::test_lightning_training_respects_gridsize
tests/torch/test_workflows_components.py::TestTrainWithLightningRed::test_train_with_lightning_instantiates_module
  /home/ollie/miniconda3/envs/ptycho311/lib/python3.11/site-packages/lightning/pytorch/trainer/setup.py:177: GPU available but not used. You can set it by doing `Trainer(accelerator='gpu')`.

tests/torch/test_workflows_components.py::TestWorkflowsComponentsTraining::test_lightning_poisson_count_contract
  /home/ollie/miniconda3/envs/ptycho311/lib/python3.11/site-packages/lightning/pytorch/core/module.py:449: You are trying to `self.log()` but the `self.trainer` reference is not registered on the model yet. This is most likely because the model hasn't been passed to the `Trainer`

tests/torch/test_workflows_components.py::TestWorkflowsComponentsTraining::test_lightning_training_respects_gridsize
tests/torch/test_workflows_components.py::TestTrainWithLightningRed::test_train_with_lightning_instantiates_module
  /home/ollie/miniconda3/envs/ptycho311/lib/python3.11/site-packages/lightning/pytorch/callbacks/model_checkpoint.py:751: Checkpoint directory /home/ollie/Documents/PtychoPINN2/training_outputs/checkpoints exists and is not empty.

tests/torch/test_workflows_components.py::TestWorkflowsComponentsTraining::test_lightning_training_respects_gridsize
tests/torch/test_workflows_components.py::TestTrainWithLightningRed::test_train_with_lightning_instantiates_module
  /home/ollie/miniconda3/envs/ptycho311/lib/python3.11/site-packages/lightning/pytorch/trainer/connectors/data_connector.py:433: The 'train_dataloader' does not have many workers which may be a bottleneck. Consider increasing the value of the `num_workers` argument` to `num_workers=31` in the `DataLoader` to improve performance.

tests/torch/test_workflows_components.py::TestWorkflowsComponentsTraining::test_lightning_training_respects_gridsize
  /home/ollie/miniconda3/envs/ptycho311/lib/python3.11/site-packages/lightning/pytorch/callbacks/model_checkpoint.py:467: `ModelCheckpoint(monitor='train_loss')` could not find the monitored key in the returned metrics: ['epoch', 'step']. HINT: Did you call `log('train_loss', value)` in the `LightningModule`?

-- Docs: https://docs.pytest.org/en/stable/how-to/capture-warnings.html
=========================== short test summary info ============================
SKIPPED [1] tests/test_benchmark_throughput.py:11: scripts/benchmark_inference_throughput.py not found. This is a pre-existing broken test dependency. Add to fix_plan.md for future resolution.
SKIPPED [1] tests/test_run_baseline.py:4: tests/test_utilities.py not found. This is a pre-existing broken test dependency. Add to fix_plan.md for future resolution.
SKIPPED [1] tests/test_generic_loader.py:46: Data loading failed:
SKIPPED [1] tests/test_integration_baseline_gs2.py:27: Test data not found at /home/ollie/Documents/PtychoPINN2/datasets/fly/fly001_transposed.npz
SKIPPED [1] ../../miniconda3/envs/ptycho311/lib/python3.11/site-packages/_pytest/unittest.py:385: Deprecated: generate_simulated_data API changed from (obj,probe,nimages) to (config,obj,probe) and memoization disabled
SKIPPED [1] tests/test_tf_helper.py:199: TensorFlow Addons removed in TF 2.19 migration
SKIPPED [1] tests/test_tf_helper_edge_aware.py:47: tensorflow_addons not available
SKIPPED [1] tests/test_tf_helper_edge_aware.py:86: tensorflow_addons not available
SKIPPED [1] tests/test_tf_helper_edge_aware.py:198: tensorflow_addons not available
SKIPPED [1] tests/test_tf_helper_edge_aware.py:169: tensorflow_addons not available
SKIPPED [1] tests/test_tf_helper_edge_aware.py:257: tensorflow_addons not available
SKIPPED [1] tests/test_tf_helper_edge_aware.py:227: tensorflow_addons not available
SKIPPED [2] tests/torch/test_integration_workflow_torch.py: Migrated to pytest-native test_run_pytorch_train_save_load_infer
SKIPPED [1] tests/torch/test_tf_helper.py:64: torch tf_helper module not available
SKIPPED [1] tests/torch/test_tf_helper.py:57: torch tf_helper module not available
SKIPPED [1] tests/torch/test_tf_helper.py:74: torch tf_helper module not available - tests would fail
FAILED tests/io/test_ptychodus_interop_h5.py::test_interop_h5_reader - Module...
FAILED tests/study/test_phase_g_dense_artifacts_verifier.py::test_verify_dense_pipeline_artifact_inventory_passes_with_complete_bundle
===== 2 failed, 435 passed, 17 skipped, 104 warnings in 251.01s (0:04:11) ======
