============================= test session starts ==============================
platform linux -- Python 3.11.13, pytest-8.4.1, pluggy-1.6.0 -- /home/ollie/miniconda3/envs/ptycho311/bin/python3.11
cachedir: .pytest_cache
PyTorch: available
PyTorch version: 2.8.0+cu128
rootdir: /home/ollie/Documents/PtychoPINN2
configfile: pyproject.toml
plugins: anyio-4.9.0
collecting ... collected 348 items / 2 skipped

tests/image/test_cropping.py::TestCroppingAlignment::test_align_for_evaluation_bounding_box PASSED [  0%]
tests/image/test_cropping.py::TestCroppingAlignment::test_align_for_evaluation_coordinates_format PASSED [  0%]
tests/image/test_cropping.py::TestCroppingAlignment::test_align_for_evaluation_shapes PASSED [  0%]
tests/image/test_cropping.py::TestCroppingAlignment::test_align_for_evaluation_with_squeeze PASSED [  1%]
tests/image/test_cropping.py::TestCroppingAlignment::test_center_crop_exact_size PASSED [  1%]
tests/image/test_registration.py::TestRegistration::test_apply_shift_and_crop_basic PASSED [  1%]
tests/image/test_registration.py::TestRegistration::test_apply_shift_and_crop_zero_offset PASSED [  2%]
tests/image/test_registration.py::TestRegistration::test_different_image_content PASSED [  2%]
tests/image/test_registration.py::TestRegistration::test_edge_case_maximum_shift PASSED [  2%]
tests/image/test_registration.py::TestRegistration::test_edge_case_single_pixel_shift PASSED [  2%]
tests/image/test_registration.py::TestRegistration::test_find_offset_known_shift_complex PASSED [  3%]
tests/image/test_registration.py::TestRegistration::test_find_offset_known_shift_real PASSED [  3%]
tests/image/test_registration.py::TestRegistration::test_input_validation_2d_requirement PASSED [  3%]
tests/image/test_registration.py::TestRegistration::test_input_validation_excessive_offset PASSED [  4%]
tests/image/test_registration.py::TestRegistration::test_input_validation_shape_matching PASSED [  4%]
tests/image/test_registration.py::TestRegistration::test_noise_robustness PASSED [  4%]
tests/image/test_registration.py::TestRegistration::test_register_and_align_convenience PASSED [  4%]
tests/image/test_registration.py::TestRegistration::test_registration_sign_verification PASSED [  5%]
tests/image/test_registration.py::TestRegistration::test_round_trip_registration PASSED [  5%]
tests/image/test_registration.py::TestRegistration::test_shift_and_crop_preserves_data_type PASSED [  5%]
tests/test_baselines.py::TestBaselines::test_build_model_always_creates_single_channel_output PASSED [  6%]
tests/test_cli_args.py::TestCliArgs::test_add_logging_arguments PASSED   [  6%]
tests/test_cli_args.py::TestCliArgs::test_console_level_choices PASSED   [  6%]
tests/test_cli_args.py::TestCliArgs::test_get_logging_config_custom_level PASSED [  6%]
tests/test_cli_args.py::TestCliArgs::test_get_logging_config_defaults PASSED [  7%]
tests/test_cli_args.py::TestCliArgs::test_get_logging_config_quiet PASSED [  7%]
tests/test_cli_args.py::TestCliArgs::test_get_logging_config_verbose PASSED [  7%]
tests/test_cli_args.py::TestCliArgs::test_quiet_verbose_mutually_exclusive PASSED [  8%]
tests/test_coordinate_grouping.py::TestCoordinateGrouping::test_backward_compatibility PASSED [  8%]
tests/test_coordinate_grouping.py::TestCoordinateGrouping::test_different_seeds_produce_different_results PASSED [  8%]
tests/test_coordinate_grouping.py::TestCoordinateGrouping::test_edge_case_k_less_than_c PASSED [  8%]
tests/test_coordinate_grouping.py::TestCoordinateGrouping::test_edge_case_more_samples_than_points PASSED [  9%]
tests/test_coordinate_grouping.py::TestCoordinateGrouping::test_edge_case_small_dataset PASSED [  9%]
tests/test_coordinate_grouping.py::TestCoordinateGrouping::test_efficient_grouping_output_shape PASSED [  9%]
tests/test_coordinate_grouping.py::TestCoordinateGrouping::test_efficient_grouping_spatial_coherence PASSED [ 10%]
tests/test_coordinate_grouping.py::TestCoordinateGrouping::test_efficient_grouping_valid_indices PASSED [ 10%]
tests/test_coordinate_grouping.py::TestCoordinateGrouping::test_generate_grouped_data_gridsize_1 PASSED [ 10%]
tests/test_coordinate_grouping.py::TestCoordinateGrouping::test_generate_grouped_data_integration PASSED [ 10%]
tests/test_coordinate_grouping.py::TestCoordinateGrouping::test_memory_efficiency PASSED [ 11%]
tests/test_coordinate_grouping.py::TestCoordinateGrouping::test_no_cache_files_created PASSED [ 11%]
tests/test_coordinate_grouping.py::TestCoordinateGrouping::test_performance_improvement PASSED [ 11%]
tests/test_coordinate_grouping.py::TestCoordinateGrouping::test_reproducibility_with_seed PASSED [ 12%]
tests/test_coordinate_grouping.py::TestIntegrationWithExistingCode::test_existing_tests_still_pass PASSED [ 12%]
tests/test_generic_loader.py::TestGenericLoader::test_generic_loader_roundtrip SKIPPED [ 12%]
tests/test_generic_loader.py::test_generic_loader PASSED                 [ 12%]
tests/test_integration_baseline_gs2.py::TestBaselineGridsize2Integration::test_baseline_gridsize2_end_to_end SKIPPED [ 13%]
tests/test_integration_workflow.py::TestFullWorkflow::test_train_save_load_infer_cycle PASSED [ 13%]
tests/test_log_config.py::TestLogConfig::test_backward_compatibility PASSED [ 13%]
tests/test_log_config.py::TestLogConfig::test_conflicting_flags_verbose_overrides PASSED [ 14%]
tests/test_log_config.py::TestLogConfig::test_custom_console_level PASSED [ 14%]
tests/test_log_config.py::TestLogConfig::test_default_setup_logging_creates_log_directory_and_file PASSED [ 14%]
tests/test_log_config.py::TestLogConfig::test_quiet_flag_overrides_console_level PASSED [ 14%]
tests/test_log_config.py::TestLogConfig::test_quiet_mode_disables_console PASSED [ 15%]
tests/test_log_config.py::TestLogConfig::test_setup_logging_clears_existing_handlers PASSED [ 15%]
tests/test_log_config.py::TestLogConfig::test_string_path_support PASSED [ 15%]
tests/test_log_config.py::TestLogConfig::test_verbose_mode_enables_debug_console PASSED [ 16%]
tests/test_misc.py::test_memoize_simulated_data SKIPPED (Deprecated:...) [ 16%]
tests/test_nphotons_metadata_integration.py::TestNphotonsMetadataIntegration::test_configuration_mismatch_warnings PASSED [ 16%]
tests/test_nphotons_metadata_integration.py::TestNphotonsMetadataIntegration::test_end_to_end_workflow_consistency PASSED [ 16%]
tests/test_nphotons_metadata_integration.py::TestNphotonsMetadataIntegration::test_metadata_backward_compatibility PASSED [ 17%]
tests/test_nphotons_metadata_integration.py::TestNphotonsMetadataIntegration::test_metadata_persistence_single_nphotons PASSED [ 17%]
tests/test_nphotons_metadata_integration.py::TestNphotonsMetadataIntegration::test_multiple_nphotons_metadata_consistency PASSED [ 17%]
tests/test_nphotons_metadata_integration.py::TestNphotonsMetadataIntegration::test_training_with_mismatched_config_warns_but_continues PASSED [ 18%]
tests/test_oversampling.py::TestAutomaticOversampling::test_automatic_oversampling_triggers PASSED [ 18%]
tests/test_oversampling.py::TestAutomaticOversampling::test_gridsize_1_no_oversampling PASSED [ 18%]
tests/test_oversampling.py::TestAutomaticOversampling::test_oversampling_with_different_k_values PASSED [ 18%]
tests/test_oversampling.py::TestAutomaticOversampling::test_reproducibility_with_seed PASSED [ 19%]
tests/test_oversampling.py::TestAutomaticOversampling::test_standard_sampling_no_oversampling PASSED [ 19%]
tests/test_projective_warp_xla.py::TestProjectiveWarpXLA::test_batch_processing PASSED [ 19%]
tests/test_projective_warp_xla.py::TestProjectiveWarpXLA::test_complex128_dtype PASSED [ 20%]
tests/test_projective_warp_xla.py::TestProjectiveWarpXLA::test_complex64_dtype PASSED [ 20%]
tests/test_projective_warp_xla.py::TestProjectiveWarpXLA::test_fill_modes PASSED [ 20%]
tests/test_projective_warp_xla.py::TestProjectiveWarpXLA::test_float32_dtype PASSED [ 20%]
tests/test_projective_warp_xla.py::TestProjectiveWarpXLA::test_float64_dtype PASSED [ 21%]
tests/test_projective_warp_xla.py::TestProjectiveWarpXLA::test_float64_with_translation PASSED [ 21%]
tests/test_projective_warp_xla.py::TestProjectiveWarpXLA::test_interpolation_modes PASSED [ 21%]
tests/test_projective_warp_xla.py::TestProjectiveWarpXLA::test_jit_compilation_float32 PASSED [ 22%]
tests/test_projective_warp_xla.py::TestProjectiveWarpXLA::test_jit_compilation_float64 PASSED [ 22%]
tests/test_projective_warp_xla.py::TestProjectiveWarpXLA::test_mixed_precision_translation PASSED [ 22%]
tests/test_projective_warp_xla.py::TestProjectiveWarpXLA::test_tfa_params_conversion PASSED [ 22%]
tests/test_raw_data_grouping.py::TestRawDataGrouping::test_content_validity PASSED [ 23%]
tests/test_raw_data_grouping.py::TestRawDataGrouping::test_edge_case_k_less_than_c PASSED [ 23%]
tests/test_raw_data_grouping.py::TestRawDataGrouping::test_edge_case_more_samples_than_points PASSED [ 23%]
tests/test_raw_data_grouping.py::TestRawDataGrouping::test_edge_case_small_dataset PASSED [ 24%]
tests/test_raw_data_grouping.py::TestRawDataGrouping::test_memory_efficiency PASSED [ 24%]
tests/test_raw_data_grouping.py::TestRawDataGrouping::test_output_shape PASSED [ 24%]
tests/test_raw_data_grouping.py::TestRawDataGrouping::test_performance_improvement PASSED [ 25%]
tests/test_raw_data_grouping.py::TestRawDataGrouping::test_reproducibility PASSED [ 25%]
tests/test_raw_data_grouping.py::TestRawDataGrouping::test_uniform_sampling PASSED [ 25%]
tests/test_scaling_regression.py::TestScalingRegression::test_both_arrays_scaled_identically PASSED [ 25%]
tests/test_scaling_regression.py::TestScalingRegression::test_different_nphotons_produce_proportional_scaling PASSED [ 26%]
tests/test_scaling_regression.py::TestScalingRegression::test_intensity_scale_is_valid PASSED [ 26%]
tests/test_scaling_regression.py::TestScalingRegression::test_phase_is_not_scaled PASSED [ 26%]
tests/test_scaling_regression.py::TestScalingRegression::test_scaling_is_reversible PASSED [ 27%]
tests/test_scaling_regression.py::TestScalingRegression::test_scaling_preserves_physics PASSED [ 27%]
tests/test_scaling_regression.py::TestScalingAssertions::test_assertions_catch_invalid_intensity_scale PASSED [ 27%]
tests/test_sequential_sampling.py::TestSequentialSampling::test_default_behavior_is_random PASSED [ 27%]
tests/test_sequential_sampling.py::TestSequentialSampling::test_sequential_sampling_handles_edge_cases PASSED [ 28%]
tests/test_sequential_sampling.py::TestSequentialSampling::test_sequential_sampling_is_deterministic PASSED [ 28%]
tests/test_sequential_sampling.py::TestSequentialSampling::test_sequential_sampling_order PASSED [ 28%]
tests/test_sequential_sampling.py::TestSequentialSampling::test_sequential_sampling_uses_first_n_points PASSED [ 29%]
tests/test_sequential_sampling.py::TestSequentialSampling::test_sequential_sampling_with_gridsize_greater_than_1 PASSED [ 29%]
tests/test_sequential_sampling.py::TestSequentialSampling::test_sequential_sampling_with_seed_parameter PASSED [ 29%]
tests/test_sequential_sampling.py::TestSequentialSampling::test_sequential_vs_random_coverage PASSED [ 29%]
tests/test_sequential_sampling.py::TestIntegrationWithWorkflow::test_cli_argument_parsing PASSED [ 30%]
tests/test_sequential_sampling.py::TestIntegrationWithWorkflow::test_config_flag_exists PASSED [ 30%]
tests/test_subsampling.py::TestSubsampling::test_different_seeds_produce_different_results PASSED [ 30%]
tests/test_subsampling.py::TestSubsampling::test_interaction_with_config_dataclass PASSED [ 31%]
tests/test_subsampling.py::TestSubsampling::test_legacy_n_images_behavior PASSED [ 31%]
tests/test_subsampling.py::TestSubsampling::test_n_subsample_overrides_n_images PASSED [ 31%]
tests/test_subsampling.py::TestSubsampling::test_no_subsample_uses_full_dataset PASSED [ 31%]
tests/test_subsampling.py::TestSubsampling::test_reproducible_subsampling_with_seed PASSED [ 32%]
tests/test_subsampling.py::TestSubsampling::test_sorted_indices_for_consistency PASSED [ 32%]
tests/test_subsampling.py::TestSubsampling::test_subsample_larger_than_dataset PASSED [ 32%]
tests/test_subsampling.py::TestSubsampling::test_subsample_with_n_subsample PASSED [ 33%]
tests/test_subsampling.py::TestSubsampling::test_subsample_zero_edge_case PASSED [ 33%]
tests/test_subsampling.py::TestSubsampling::test_y_patches_subsampled_consistently PASSED [ 33%]
tests/test_tf_helper.py::TestReassemblePosition::test_basic_functionality PASSED [ 33%]
tests/test_tf_helper.py::TestReassemblePosition::test_different_patch_values_blend PASSED [ 34%]
tests/test_tf_helper.py::TestReassemblePosition::test_identical_patches_single_vs_double PASSED [ 34%]
tests/test_tf_helper.py::TestReassemblePosition::test_perfect_overlap_averages_to_identity PASSED [ 34%]
tests/test_tf_helper.py::TestTranslateFunction::test_batch_translation PASSED [ 35%]
tests/test_tf_helper.py::TestTranslateFunction::test_complex_tensor_translation PASSED [ 35%]
tests/test_tf_helper.py::TestTranslateFunction::test_edge_cases PASSED   [ 35%]
tests/test_tf_helper.py::TestTranslateFunction::test_integer_translation PASSED [ 35%]
tests/test_tf_helper.py::TestTranslateFunction::test_subpixel_translation PASSED [ 36%]
tests/test_tf_helper.py::TestTranslateFunction::test_translate_core_matches_addons SKIPPED [ 36%]
tests/test_tf_helper.py::TestTranslateFunction::test_zero_translation PASSED [ 36%]
tests/test_tf_helper_edge_aware.py::TestTranslateSmoothPatterns::test_complex_smooth_translation PASSED [ 37%]
tests/test_tf_helper_edge_aware.py::TestTranslateSmoothPatterns::test_gaussian_probe_translation SKIPPED [ 37%]
tests/test_tf_helper_edge_aware.py::TestTranslateSmoothPatterns::test_smooth_object_translation SKIPPED [ 37%]
tests/test_tf_helper_edge_aware.py::TestTranslateEdgeCases::test_boundary_behavior SKIPPED [ 37%]
tests/test_tf_helper_edge_aware.py::TestTranslateEdgeCases::test_document_edge_differences SKIPPED [ 38%]
tests/test_tf_helper_edge_aware.py::TestPtychoPINNRelevantCases::test_batch_smooth_patterns SKIPPED [ 38%]
tests/test_tf_helper_edge_aware.py::TestPtychoPINNRelevantCases::test_typical_probe_sizes SKIPPED [ 38%]
tests/test_workflow_components.py::TestLoadInferenceBundle::test_exception_propagation PASSED [ 39%]
tests/test_workflow_components.py::TestLoadInferenceBundle::test_load_valid_model_directory PASSED [ 39%]
tests/test_workflow_components.py::TestLoadInferenceBundle::test_missing_diffraction_model PASSED [ 39%]
tests/test_workflow_components.py::TestLoadInferenceBundle::test_missing_model_archive PASSED [ 39%]
tests/test_workflow_components.py::TestLoadInferenceBundle::test_nonexistent_directory PASSED [ 40%]
tests/test_workflow_components.py::TestLoadInferenceBundle::test_not_a_directory PASSED [ 40%]
tests/test_workflow_components.py::TestLoadInferenceBundle::test_path_conversion PASSED [ 40%]
tests/tools/test_generate_test_index.py::GenerateTestIndexTests::test_get_module_docstring_handles_missing_docstring PASSED [ 41%]
tests/tools/test_generate_test_index.py::GenerateTestIndexTests::test_get_module_docstring_reads_existing_docstring PASSED [ 41%]
tests/tools/test_generate_test_index.py::GenerateTestIndexTests::test_get_test_functions_lists_key_tests PASSED [ 41%]
tests/tools/test_tail_interleave_logs.py::test_interleave_summaries PASSED [ 41%]
tests/tools/test_update_tool.py::TestUpdateTool::test_update_function PASSED [ 42%]
tests/tools/test_update_tool.py::test_update_function PASSED             [ 42%]
tests/torch/test_backend_selection.py::TestBackendSelection::test_defaults_to_tensorflow_backend PASSED [ 42%]
tests/torch/test_backend_selection.py::TestBackendSelection::test_selects_pytorch_backend PASSED [ 43%]
tests/torch/test_backend_selection.py::TestBackendSelection::test_pytorch_backend_calls_update_legacy_dict PASSED [ 43%]
tests/torch/test_backend_selection.py::TestBackendSelection::test_pytorch_unavailable_raises_error PASSED [ 43%]
tests/torch/test_backend_selection.py::TestBackendSelection::test_inference_config_supports_backend_selection PASSED [ 43%]
tests/torch/test_backend_selection.py::TestBackendSelection::test_backend_selection_preserves_api_parity PASSED [ 44%]
tests/torch/test_cli_inference_torch.py::TestInferenceCLI::test_accelerator_flag_roundtrip PASSED [ 44%]
tests/torch/test_cli_inference_torch.py::TestInferenceCLI::test_num_workers_flag_roundtrip PASSED [ 44%]
tests/torch/test_cli_inference_torch.py::TestInferenceCLI::test_inference_batch_size_flag_roundtrip PASSED [ 45%]
tests/torch/test_cli_inference_torch.py::TestInferenceCLI::test_multiple_execution_config_flags PASSED [ 45%]
tests/torch/test_cli_inference_torch.py::TestInferenceCLIThinWrapper::test_cli_delegates_to_validate_paths PASSED [ 45%]
tests/torch/test_cli_inference_torch.py::TestInferenceCLIThinWrapper::test_cli_delegates_to_helper_for_data_loading PASSED [ 45%]
tests/torch/test_cli_inference_torch.py::TestInferenceCLIThinWrapper::test_cli_delegates_to_inference_helper PASSED [ 46%]
tests/torch/test_cli_inference_torch.py::TestInferenceCLIThinWrapper::test_cli_calls_save_individual_reconstructions PASSED [ 46%]
tests/torch/test_cli_inference_torch.py::TestInferenceCLIThinWrapper::test_quiet_flag_suppresses_progress_output PASSED [ 46%]
tests/torch/test_cli_shared.py::TestResolveAccelerator::test_default_no_device PASSED [ 47%]
tests/torch/test_cli_shared.py::TestResolveAccelerator::test_legacy_device_cpu PASSED [ 47%]
tests/torch/test_cli_shared.py::TestResolveAccelerator::test_legacy_device_cuda_maps_to_gpu PASSED [ 47%]
tests/torch/test_cli_shared.py::TestResolveAccelerator::test_conflict_accelerator_wins PASSED [ 47%]
tests/torch/test_cli_shared.py::TestResolveAccelerator::test_all_accelerator_values_passthrough PASSED [ 48%]
tests/torch/test_cli_shared.py::TestBuildExecutionConfig::test_training_mode_defaults PASSED [ 48%]
tests/torch/test_cli_shared.py::TestBuildExecutionConfig::test_training_mode_custom_values PASSED [ 48%]
tests/torch/test_cli_shared.py::TestBuildExecutionConfig::test_inference_mode PASSED [ 49%]
tests/torch/test_cli_shared.py::TestBuildExecutionConfig::test_emits_deterministic_warning PASSED [ 49%]
tests/torch/test_cli_shared.py::TestBuildExecutionConfig::test_handles_quiet_flag PASSED [ 49%]
tests/torch/test_cli_shared.py::TestBuildExecutionConfig::test_handles_disable_mlflow_flag PASSED [ 50%]
tests/torch/test_cli_shared.py::TestBuildExecutionConfig::test_quiet_or_disable_mlflow_both_true PASSED [ 50%]
tests/torch/test_cli_shared.py::TestBuildExecutionConfig::test_invalid_mode_raises_value_error PASSED [ 50%]
tests/torch/test_cli_shared.py::TestBuildExecutionConfig::test_resolves_accelerator_from_device_flag PASSED [ 50%]
tests/torch/test_cli_shared.py::TestValidatePaths::test_creates_output_dir PASSED [ 51%]
tests/torch/test_cli_shared.py::TestValidatePaths::test_raises_if_train_file_missing PASSED [ 51%]
tests/torch/test_cli_shared.py::TestValidatePaths::test_raises_if_test_file_missing PASSED [ 51%]
tests/torch/test_cli_shared.py::TestValidatePaths::test_accepts_none_test_file PASSED [ 52%]
tests/torch/test_cli_shared.py::TestValidatePaths::test_works_with_pathlib_path_objects PASSED [ 52%]
tests/torch/test_cli_shared.py::TestValidatePaths::test_accepts_none_train_file_for_inference_mode PASSED [ 52%]
tests/torch/test_cli_shared.py::TestBuildExecutionConfigInferenceMode::test_inference_mode_defaults PASSED [ 52%]
tests/torch/test_cli_shared.py::TestBuildExecutionConfigInferenceMode::test_inference_mode_custom_batch_size PASSED [ 53%]
tests/torch/test_cli_shared.py::TestBuildExecutionConfigInferenceMode::test_inference_mode_respects_quiet PASSED [ 53%]
tests/torch/test_cli_train_torch.py::TestExecutionConfigCLI::test_accelerator_flag_roundtrip PASSED [ 53%]
tests/torch/test_cli_train_torch.py::TestExecutionConfigCLI::test_deterministic_flag_roundtrip PASSED [ 54%]
tests/torch/test_cli_train_torch.py::TestExecutionConfigCLI::test_no_deterministic_flag_roundtrip PASSED [ 54%]
tests/torch/test_cli_train_torch.py::TestExecutionConfigCLI::test_num_workers_flag_roundtrip PASSED [ 54%]
tests/torch/test_cli_train_torch.py::TestExecutionConfigCLI::test_learning_rate_flag_roundtrip PASSED [ 54%]
tests/torch/test_cli_train_torch.py::TestExecutionConfigCLI::test_multiple_execution_config_flags PASSED [ 55%]
tests/torch/test_cli_train_torch.py::TestExecutionConfigCLI::test_bundle_persistence PASSED [ 55%]
tests/torch/test_cli_train_torch.py::TestExecutionConfigCLI::test_enable_checkpointing_flag PASSED [ 55%]
tests/torch/test_cli_train_torch.py::TestExecutionConfigCLI::test_checkpoint_save_top_k_flag PASSED [ 56%]
tests/torch/test_cli_train_torch.py::TestExecutionConfigCLI::test_checkpoint_monitor_flag PASSED [ 56%]
tests/torch/test_cli_train_torch.py::TestExecutionConfigCLI::test_checkpoint_mode_flag PASSED [ 56%]
tests/torch/test_cli_train_torch.py::TestExecutionConfigCLI::test_early_stop_patience_flag PASSED [ 56%]
tests/torch/test_cli_train_torch.py::TestExecutionConfigCLI::test_scheduler_flag_roundtrip PASSED [ 57%]
tests/torch/test_cli_train_torch.py::TestExecutionConfigCLI::test_accumulate_grad_batches_roundtrip PASSED [ 57%]
tests/torch/test_config_bridge.py::TestConfigBridgeMVP::test_mvp_config_bridge_populates_params_cfg PASSED [ 57%]
tests/torch/test_config_bridge.py::TestConfigBridgeParity::test_model_config_direct_fields[N-direct] PASSED [ 58%]
tests/torch/test_config_bridge.py::TestConfigBridgeParity::test_model_config_direct_fields[n_filters_scale-direct] PASSED [ 58%]
tests/torch/test_config_bridge.py::TestConfigBridgeParity::test_model_config_direct_fields[object_big-direct] PASSED [ 58%]
tests/torch/test_config_bridge.py::TestConfigBridgeParity::test_model_config_direct_fields[probe_big-direct] PASSED [ 58%]
tests/torch/test_config_bridge.py::TestConfigBridgeParity::test_training_config_direct_fields[batch_size-direct] PASSED [ 59%]
tests/torch/test_config_bridge.py::TestConfigBridgeParity::test_model_config_transform_fields[gridsize-tuple-to-int] PASSED [ 59%]
tests/torch/test_config_bridge.py::TestConfigBridgeParity::test_model_config_transform_fields[model_type-unsupervised] PASSED [ 59%]
tests/torch/test_config_bridge.py::TestConfigBridgeParity::test_model_config_transform_fields[model_type-supervised] PASSED [ 60%]
tests/torch/test_config_bridge.py::TestConfigBridgeParity::test_model_config_transform_fields[amp_activation-silu] PASSED [ 60%]
tests/torch/test_config_bridge.py::TestConfigBridgeParity::test_model_config_transform_fields[amp_activation-SiLU] PASSED [ 60%]
tests/torch/test_config_bridge.py::TestConfigBridgeParity::test_model_config_transform_fields[amp_activation-passthrough] PASSED [ 60%]
tests/torch/test_config_bridge.py::TestConfigBridgeParity::test_training_config_transform_fields[nepochs-rename] PASSED [ 61%]
tests/torch/test_config_bridge.py::TestConfigBridgeParity::test_training_config_transform_fields[nll_weight-true] PASSED [ 61%]
tests/torch/test_config_bridge.py::TestConfigBridgeParity::test_training_config_transform_fields[nll_weight-false] PASSED [ 61%]
tests/torch/test_config_bridge.py::TestConfigBridgeParity::test_model_config_override_fields[pad_object-default] PASSED [ 62%]
tests/torch/test_config_bridge.py::TestConfigBridgeParity::test_model_config_override_fields[pad_object-override] PASSED [ 62%]
tests/torch/test_config_bridge.py::TestConfigBridgeParity::test_model_config_override_fields[gaussian_smoothing_sigma-default] PASSED [ 62%]
tests/torch/test_config_bridge.py::TestConfigBridgeParity::test_model_config_override_fields[gaussian_smoothing_sigma-override] PASSED [ 62%]
tests/torch/test_config_bridge.py::TestConfigBridgeParity::test_training_config_override_fields[mae_weight-default] PASSED [ 63%]
tests/torch/test_config_bridge.py::TestConfigBridgeParity::test_training_config_override_fields[mae_weight-override] PASSED [ 63%]
tests/torch/test_config_bridge.py::TestConfigBridgeParity::test_training_config_override_fields[realspace_mae_weight-default] PASSED [ 63%]
tests/torch/test_config_bridge.py::TestConfigBridgeParity::test_training_config_override_fields[realspace_weight-default] PASSED [ 64%]
tests/torch/test_config_bridge.py::TestConfigBridgeParity::test_training_config_override_fields[positions_provided-default] PASSED [ 64%]
tests/torch/test_config_bridge.py::TestConfigBridgeParity::test_training_config_override_fields[probe_trainable-default] PASSED [ 64%]
tests/torch/test_config_bridge.py::TestConfigBridgeParity::test_training_config_override_fields[sequential_sampling-default] PASSED [ 64%]
tests/torch/test_config_bridge.py::TestConfigBridgeParity::test_inference_config_override_fields[debug-default] PASSED [ 65%]
tests/torch/test_config_bridge.py::TestConfigBridgeParity::test_inference_config_override_fields[debug-override] PASSED [ 65%]
tests/torch/test_config_bridge.py::TestConfigBridgeParity::test_model_config_probe_mask_translation[probe_mask-default] PASSED [ 65%]
tests/torch/test_config_bridge.py::TestConfigBridgeParity::test_model_config_probe_mask_override PASSED [ 66%]
tests/torch/test_config_bridge.py::TestConfigBridgeParity::test_default_divergence_detection[nphotons-divergence] PASSED [ 66%]
tests/torch/test_config_bridge.py::TestConfigBridgeParity::test_default_divergence_detection[probe_scale-divergence] PASSED [ 66%]
tests/torch/test_config_bridge.py::TestConfigBridgeParity::test_gridsize_error_handling[gridsize-non-square] PASSED [ 66%]
tests/torch/test_config_bridge.py::TestConfigBridgeParity::test_model_type_error_handling[model_type-invalid-enum] PASSED [ 67%]
tests/torch/test_config_bridge.py::TestConfigBridgeParity::test_activation_error_handling[amp_activation-unknown] PASSED [ 67%]
tests/torch/test_config_bridge.py::TestConfigBridgeParity::test_train_data_file_required_error PASSED [ 67%]
tests/torch/test_config_bridge.py::TestConfigBridgeParity::test_model_path_required_error PASSED [ 68%]
tests/torch/test_config_bridge.py::TestConfigBridgeParity::test_nphotons_default_divergence_error PASSED [ 68%]
tests/torch/test_config_bridge.py::TestConfigBridgeParity::test_nphotons_override_passes_validation PASSED [ 68%]
tests/torch/test_config_bridge.py::TestConfigBridgeParity::test_training_config_n_subsample_missing_override_uses_none PASSED [ 68%]
tests/torch/test_config_bridge.py::TestConfigBridgeParity::test_training_config_n_subsample_explicit_override PASSED [ 69%]
tests/torch/test_config_bridge.py::TestConfigBridgeParity::test_inference_config_n_subsample_missing_override_uses_none PASSED [ 69%]
tests/torch/test_config_bridge.py::TestConfigBridgeParity::test_inference_config_n_subsample_explicit_override PASSED [ 69%]
tests/torch/test_config_bridge.py::TestConfigBridgeParity::test_n_groups_missing_override_warning PASSED [ 70%]
tests/torch/test_config_bridge.py::TestConfigBridgeParity::test_test_data_file_training_missing_warning PASSED [ 70%]
tests/torch/test_config_bridge.py::TestConfigBridgeParity::test_params_cfg_matches_baseline PASSED [ 70%]
tests/torch/test_config_factory.py::TestTrainingPayloadStructure::test_training_payload_returns_dataclass PASSED [ 70%]
tests/torch/test_config_factory.py::TestTrainingPayloadStructure::test_training_payload_contains_tf_config PASSED [ 71%]
tests/torch/test_config_factory.py::TestTrainingPayloadStructure::test_training_payload_contains_pytorch_configs PASSED [ 71%]
tests/torch/test_config_factory.py::TestTrainingPayloadStructure::test_training_payload_contains_overrides_dict PASSED [ 71%]
tests/torch/test_config_factory.py::TestTrainingPayloadStructure::test_gridsize_sets_channel_count PASSED [ 72%]
tests/torch/test_config_factory.py::TestInferencePayloadStructure::test_inference_payload_returns_dataclass PASSED [ 72%]
tests/torch/test_config_factory.py::TestInferencePayloadStructure::test_inference_payload_contains_tf_config PASSED [ 72%]
tests/torch/test_config_factory.py::TestInferencePayloadStructure::test_inference_payload_contains_pytorch_configs PASSED [ 72%]
tests/torch/test_config_factory.py::TestConfigBridgeTranslation::test_grid_size_tuple_to_gridsize_int PASSED [ 73%]
tests/torch/test_config_factory.py::TestConfigBridgeTranslation::test_epochs_to_nepochs_conversion PASSED [ 73%]
tests/torch/test_config_factory.py::TestConfigBridgeTranslation::test_k_to_neighbor_count_conversion PASSED [ 73%]
tests/torch/test_config_factory.py::TestLegacyParamsPopulation::test_factory_populates_params_cfg PASSED [ 74%]
tests/torch/test_config_factory.py::TestLegacyParamsPopulation::test_populate_legacy_params_helper PASSED [ 74%]
tests/torch/test_config_factory.py::TestOverridePrecedence::test_override_dict_wins_over_defaults PASSED [ 74%]
tests/torch/test_config_factory.py::TestOverridePrecedence::test_probe_size_override_wins_over_inference PASSED [ 75%]
tests/torch/test_config_factory.py::TestFactoryValidation::test_missing_n_groups_raises_error PASSED [ 75%]
tests/torch/test_config_factory.py::TestFactoryValidation::test_nonexistent_train_data_file_raises_error PASSED [ 75%]
tests/torch/test_config_factory.py::TestFactoryValidation::test_missing_checkpoint_raises_error PASSED [ 75%]
tests/torch/test_config_factory.py::TestExecutionConfigOverrides::test_training_payload_execution_config_not_none PASSED [ 76%]
tests/torch/test_config_factory.py::TestExecutionConfigOverrides::test_inference_payload_execution_config_not_none PASSED [ 76%]
tests/torch/test_config_factory.py::TestExecutionConfigOverrides::test_execution_config_defaults_applied PASSED [ 76%]
tests/torch/test_config_factory.py::TestExecutionConfigOverrides::test_execution_config_explicit_instance_propagates PASSED [ 77%]
tests/torch/test_config_factory.py::TestExecutionConfigOverrides::test_execution_config_fields_accessible PASSED [ 77%]
tests/torch/test_config_factory.py::TestExecutionConfigOverrides::test_overrides_applied_records_execution_knobs PASSED [ 77%]
tests/torch/test_config_factory.py::TestExecutionConfigOverrides::test_checkpoint_knobs_propagate_through_factory PASSED [ 77%]
tests/torch/test_config_factory.py::TestExecutionConfigOverrides::test_checkpoint_defaults_respected PASSED [ 78%]
tests/torch/test_config_factory.py::TestExecutionConfigOverrides::test_scheduler_override_applied PASSED [ 78%]
tests/torch/test_config_factory.py::TestExecutionConfigOverrides::test_accum_steps_override_applied PASSED [ 78%]
tests/torch/test_config_factory.py::TestProbeSizeInference::test_infer_probe_size_from_npz PASSED [ 79%]
tests/torch/test_config_factory.py::TestProbeSizeInference::test_infer_probe_size_missing_file_fallback PASSED [ 79%]
tests/torch/test_data_pipeline.py::TestRawDataTorchAdapter::test_raw_data_torch_matches_tensorflow PASSED [ 79%]
tests/torch/test_data_pipeline.py::TestDataContainerParity::test_data_container_shapes_and_dtypes PASSED [ 79%]
tests/torch/test_data_pipeline.py::TestGroundTruthLoading::test_y_patches_are_complex64 PASSED [ 80%]
tests/torch/test_data_pipeline.py::TestMemmapBridgeParity::test_memmap_loader_matches_raw_data_torch PASSED [ 80%]
tests/torch/test_data_pipeline.py::TestMemmapBridgeParity::test_deterministic_generation_validation PASSED [ 80%]
tests/torch/test_dataloader.py::TestDataloaderCanonicalKeySupport::test_backward_compat_legacy_diff3d PASSED [ 81%]
tests/torch/test_dataloader.py::TestDataloaderCanonicalKeySupport::test_error_when_no_diffraction_key PASSED [ 81%]
tests/torch/test_dataloader.py::TestDataloaderCanonicalKeySupport::test_loads_canonical_diffraction PASSED [ 81%]
tests/torch/test_dataloader.py::TestDataloaderFormatAutoTranspose::test_auto_transposes_legacy_hwn_format PASSED [ 81%]
tests/torch/test_dataloader.py::TestDataloaderFormatAutoTranspose::test_handles_edge_case_square_dataset PASSED [ 82%]
tests/torch/test_dataloader.py::TestDataloaderFormatAutoTranspose::test_npz_headers_also_transposes_shape PASSED [ 82%]
tests/torch/test_dataloader.py::TestDataloaderFormatAutoTranspose::test_preserves_canonical_nwh_format PASSED [ 82%]
tests/torch/test_dataloader.py::TestDataloaderFormatAutoTranspose::test_real_dataset_dimensions PASSED [ 83%]
tests/torch/test_dataloader.py::TestDataloaderFormatAutoTranspose::test_works_with_diff3d_legacy_key PASSED [ 83%]
tests/torch/test_fixture_pytorch_integration.py::TestFixtureContract::test_fixture_file_exists PASSED [ 83%]
tests/torch/test_fixture_pytorch_integration.py::TestFixtureContract::test_fixture_outputs_match_contract PASSED [ 83%]
tests/torch/test_fixture_pytorch_integration.py::TestFixtureContract::test_metadata_sidecar_exists PASSED [ 84%]
tests/torch/test_fixture_pytorch_integration.py::TestFixtureContract::test_metadata_content_valid PASSED [ 84%]
tests/torch/test_fixture_pytorch_integration.py::TestFixtureContract::test_coordinate_coverage PASSED [ 84%]
tests/torch/test_fixture_pytorch_integration.py::TestFixtureIntegrationSmoke::test_fixture_loads_with_rawdata PASSED [ 85%]
tests/torch/test_fixture_pytorch_integration.py::TestFixtureIntegrationSmoke::test_fixture_compatible_with_pytorch_dataloader PASSED [ 85%]
tests/torch/test_integration_workflow_torch.py::test_bundle_loader_returns_modules FAILED [ 85%]
tests/torch/test_integration_workflow_torch.py::test_run_pytorch_train_save_load_infer FAILED [ 85%]
tests/torch/test_integration_workflow_torch.py::TestPyTorchIntegrationWorkflow::test_pytorch_train_save_load_infer_cycle_legacy SKIPPED [ 86%]
tests/torch/test_integration_workflow_torch.py::TestPyTorchIntegrationWorkflow::test_pytorch_tf_output_parity SKIPPED [ 86%]
tests/torch/test_lightning_checkpoint.py::TestLightningCheckpointSerialization::test_checkpoint_contains_hyperparameters PASSED [ 86%]
tests/torch/test_lightning_checkpoint.py::TestLightningCheckpointSerialization::test_load_from_checkpoint_without_kwargs PASSED [ 87%]
tests/torch/test_lightning_checkpoint.py::TestLightningCheckpointSerialization::test_checkpoint_configs_are_serializable PASSED [ 87%]
tests/torch/test_model_manager.py::TestSaveTorchBundle::test_archive_structure PASSED [ 87%]
tests/torch/test_model_manager.py::TestSaveTorchBundle::test_params_snapshot PASSED [ 87%]
tests/torch/test_model_manager.py::TestLoadTorchBundle::test_load_round_trip_updates_params_cfg PASSED [ 88%]
tests/torch/test_model_manager.py::TestLoadTorchBundle::test_missing_params_raises_value_error PASSED [ 88%]
tests/torch/test_model_manager.py::TestLoadTorchBundle::test_load_round_trip_returns_model_stub PASSED [ 88%]
tests/torch/test_model_manager.py::TestLoadTorchBundle::test_reconstructs_models_from_bundle PASSED [ 89%]
tests/torch/test_tf_helper.py::TestTorchTFHelper::test_combine_complex SKIPPED [ 89%]
tests/torch/test_tf_helper.py::TestTorchTFHelper::test_get_mask SKIPPED  [ 89%]
tests/torch/test_tf_helper.py::TestTorchTFHelper::test_placeholder_torch_functions SKIPPED [ 89%]
tests/torch/test_train_probe_size.py::TestNPZProbeSizeExtraction::test_infer_probe_size_128 PASSED [ 90%]
tests/torch/test_train_probe_size.py::TestNPZProbeSizeExtraction::test_infer_probe_size_from_npz PASSED [ 90%]
tests/torch/test_train_probe_size.py::TestNPZProbeSizeExtraction::test_infer_probe_size_missing_probe PASSED [ 90%]
tests/torch/test_train_probe_size.py::TestNPZProbeSizeExtraction::test_infer_probe_size_real_dataset PASSED [ 91%]
tests/torch/test_train_probe_size.py::TestNPZProbeSizeExtraction::test_infer_probe_size_rectangular PASSED [ 91%]
tests/torch/test_workflows_components.py::TestWorkflowsComponentsScaffold::test_run_cdi_example_calls_update_legacy_dict PASSED [ 91%]
tests/torch/test_workflows_components.py::TestWorkflowsComponentsTraining::test_train_cdi_model_torch_invokes_lightning PASSED [ 91%]
tests/torch/test_workflows_components.py::TestWorkflowsComponentsTraining::test_lightning_dataloader_tensor_dict_structure PASSED [ 92%]
tests/torch/test_workflows_components.py::TestWorkflowsComponentsTraining::test_lightning_poisson_count_contract PASSED [ 92%]
tests/torch/test_workflows_components.py::TestWorkflowsComponentsTraining::test_lightning_training_respects_gridsize PASSED [ 92%]
tests/torch/test_workflows_components.py::TestWorkflowsComponentsTraining::test_coords_relative_layout PASSED [ 93%]
tests/torch/test_workflows_components.py::TestWorkflowsComponentsRun::test_run_cdi_example_invokes_training PASSED [ 93%]
tests/torch/test_workflows_components.py::TestWorkflowsComponentsRun::test_run_cdi_example_persists_models PASSED [ 93%]
tests/torch/test_workflows_components.py::TestWorkflowsComponentsRun::test_load_inference_bundle_handles_bundle PASSED [ 93%]
tests/torch/test_workflows_components.py::TestTrainWithLightningRed::test_train_with_lightning_instantiates_module PASSED [ 94%]
tests/torch/test_workflows_components.py::TestTrainWithLightningRed::test_train_with_lightning_runs_trainer_fit PASSED [ 94%]
tests/torch/test_workflows_components.py::TestTrainWithLightningRed::test_train_with_lightning_returns_models_dict PASSED [ 94%]
tests/torch/test_workflows_components.py::TestReassembleCdiImageTorchGreen::test_reassemble_cdi_image_torch_guard_without_train_results PASSED [ 95%]
tests/torch/test_workflows_components.py::TestReassembleCdiImageTorchGreen::test_reassemble_cdi_image_torch_flip_transpose_contract[False-False-False] PASSED [ 95%]
tests/torch/test_workflows_components.py::TestReassembleCdiImageTorchGreen::test_reassemble_cdi_image_torch_flip_transpose_contract[True-False-False] PASSED [ 95%]
tests/torch/test_workflows_components.py::TestReassembleCdiImageTorchGreen::test_reassemble_cdi_image_torch_flip_transpose_contract[False-True-False] PASSED [ 95%]
tests/torch/test_workflows_components.py::TestReassembleCdiImageTorchGreen::test_reassemble_cdi_image_torch_flip_transpose_contract[False-False-True] PASSED [ 96%]
tests/torch/test_workflows_components.py::TestReassembleCdiImageTorchGreen::test_reassemble_cdi_image_torch_flip_transpose_contract[True-True-True] PASSED [ 96%]
tests/torch/test_workflows_components.py::TestReassembleCdiImageTorchGreen::test_run_cdi_example_torch_do_stitching_delegates_to_reassemble PASSED [ 96%]
tests/torch/test_workflows_components.py::TestReassembleCdiImageTorchGreen::test_reassemble_cdi_image_torch_return_contract PASSED [ 97%]
tests/torch/test_workflows_components.py::TestReassembleCdiImageTorchFloat32::test_batches_remain_float32 PASSED [ 97%]
tests/torch/test_workflows_components.py::TestReassembleCdiImageTorchFloat32::test_dataloader_casts_float64_to_float32 PASSED [ 97%]
tests/torch/test_workflows_components.py::TestDecoderLastShapeParity::test_probe_big_shape_alignment PASSED [ 97%]
tests/torch/test_workflows_components.py::TestDecoderLastShapeParity::test_probe_big_false_no_mismatch PASSED [ 98%]
tests/torch/test_workflows_components.py::TestTrainWithLightningGreen::test_execution_config_overrides_trainer PASSED [ 98%]
tests/torch/test_workflows_components.py::TestTrainWithLightningGreen::test_execution_config_controls_determinism PASSED [ 98%]
tests/torch/test_workflows_components.py::TestInferenceExecutionConfig::test_inference_uses_execution_batch_size PASSED [ 99%]
tests/torch/test_workflows_components.py::TestLightningCheckpointCallbacks::test_model_checkpoint_callback_configured PASSED [ 99%]
tests/torch/test_workflows_components.py::TestLightningCheckpointCallbacks::test_early_stopping_callback_configured PASSED [ 99%]
tests/torch/test_workflows_components.py::TestLightningCheckpointCallbacks::test_disable_checkpointing_skips_callbacks PASSED [100%]

=================================== FAILURES ===================================
______________________ test_bundle_loader_returns_modules ______________________

tmp_path = PosixPath('/tmp/pytest-of-ollie/pytest-800/test_bundle_loader_returns_mod0')
data_file = PosixPath('/home/ollie/Documents/PtychoPINN2/tests/fixtures/pytorch_integration/minimal_dataset_v1.npz')
cuda_cpu_env = {'CLAUDECODE': '1', 'CLAUDE_CODE_ENTRYPOINT': 'sdk-cli', 'CONDA_DEFAULT_ENV': 'ptycho311', 'CONDA_EXE': '/home/ollie/miniconda3/bin/conda', ...}

    def test_bundle_loader_returns_modules(tmp_path, data_file, cuda_cpu_env):
        """
        Regression test: bundle loader must return Lightning modules, not dicts.
    
        Phase C4.D.B4: This test validates that load_inference_bundle_torch returns
        nn.Module instances that support .eval(), not sentinel dicts. The bug was
        discovered during integration testing when inference.py raised AttributeError
        on models_dict['diffraction_to_obj'].eval().
    
        Test Strategy (TDD RED phase):
        1. Train a minimal model and save bundle
        2. Load bundle via load_inference_bundle_torch
        3. Assert both models in dict are torch.nn.Module instances
        4. Assert models support .eval() without AttributeError
    
        Expected Failure: Currently returns sentinel dict for autoencoder.
        """
        import torch.nn as nn
        from ptycho_torch.workflows.components import load_inference_bundle_torch
    
        # Setup: Train and save a bundle (reuse training command from integration test)
        training_output_dir = tmp_path / "training_outputs"
        train_command = [
            sys.executable, "-m", "ptycho_torch.train",
            "--train_data_file", str(data_file),
            "--test_data_file", str(data_file),
            "--output_dir", str(training_output_dir),
            "--max_epochs", "1",  # Minimal training for faster test
            "--n_images", "32",
            "--gridsize", "1",
            "--batch_size", "4",
            "--device", "cpu",
            "--disable_mlflow",
        ]
    
        train_result = subprocess.run(
            train_command, capture_output=True, text=True, env=cuda_cpu_env, check=False
        )
    
        if train_result.returncode != 0:
>           pytest.fail(f"Training failed:\n{train_result.stderr}")
E           Failed: Training failed:
E           2025-10-23 01:18:58.171408: E external/local_xla/xla/stream_executor/cuda/cuda_fft.cc:467] Unable to register cuFFT factory: Attempting to register factory for plugin cuFFT when one has already been registered
E           WARNING: All log messages before absl::InitializeLog() is called are written to STDERR
E           E0000 00:00:1761207538.182432 2446071 cuda_dnn.cc:8579] Unable to register cuDNN factory: Attempting to register factory for plugin cuDNN when one has already been registered
E           E0000 00:00:1761207538.186130 2446071 cuda_blas.cc:1407] Unable to register cuBLAS factory: Attempting to register factory for plugin cuBLAS when one has already been registered
E           W0000 00:00:1761207538.196571 2446071 computation_placer.cc:177] computation placer already registered. Please check linkage and avoid linking the same target more than once.
E           W0000 00:00:1761207538.196583 2446071 computation_placer.cc:177] computation placer already registered. Please check linkage and avoid linking the same target more than once.
E           W0000 00:00:1761207538.196585 2446071 computation_placer.cc:177] computation placer already registered. Please check linkage and avoid linking the same target more than once.
E           W0000 00:00:1761207538.196587 2446071 computation_placer.cc:177] computation placer already registered. Please check linkage and avoid linking the same target more than once.
E           2025-10-23 01:19:00.148528: E external/local_xla/xla/stream_executor/cuda/cuda_platform.cc:51] failed call to cuInit: INTERNAL: CUDA error: Failed call to cuInit: CUDA_ERROR_NO_DEVICE: no CUDA-capable device is detected
E           2025-10-23 01:19:00.148599: E external/local_xla/xla/stream_executor/cuda/cuda_diagnostics.cc:294] kernel version 570.172.8 does not match DSO version 570.195.3 -- cannot find working devices in this configuration
E           /home/ollie/Documents/PtychoPINN2/ptycho_torch/config_factory.py:611: UserWarning: params.cfg already populated. Set force=True to overwrite existing values.
E             warnings.warn(
E           WARNING: All log messages before absl::InitializeLog() is called are written to STDERR
E           I0000 00:00:1761207542.619282 2446071 service.cc:152] XLA service 0x1356fc20 initialized for platform Host (this does not guarantee that XLA will be used). Devices:
E           I0000 00:00:1761207542.619306 2446071 service.cc:160]   StreamExecutor device (0): Host, Default Version
E           I0000 00:00:1761207542.734203 2446071 device_compiler.h:188] Compiled cluster using XLA!  This line is logged at most once for the lifetime of the process.
E           /home/ollie/Documents/PtychoPINN2/ptycho_torch/config_factory.py:257: UserWarning: test_data_file not provided in TrainingConfig overrides. Evaluation workflows require test_data_file to be set during inference update. Consider providing: overrides=dict(..., test_data_file=Path('test.npz'))
E             tf_training_config = to_training_config(
E           Seed set to 42
E           INFO:pytorch_lightning.utilities.rank_zero:GPU available: False, used: False
E           INFO:pytorch_lightning.utilities.rank_zero:TPU available: False, using: 0 TPU cores
E           INFO:pytorch_lightning.utilities.rank_zero:HPU available: False, using: 0 HPUs
E           
E             | Name  | Type        | Params | Mode 
E           ----------------------------------------------
E           0 | model | PtychoPINN  | 2.3 M  | train
E           1 | Loss  | PoissonLoss | 0      | train
E           ----------------------------------------------
E           2.3 M     Trainable params
E           0         Non-trainable params
E           2.3 M     Total params
E           9.345     Total estimated model params size (MB)
E           73        Modules in train mode
E           0         Modules in eval mode
E           /home/ollie/miniconda3/envs/ptycho311/lib/python3.11/site-packages/lightning/pytorch/trainer/connectors/data_connector.py:433: The 'val_dataloader' does not have many workers which may be a bottleneck. Consider increasing the value of the `num_workers` argument` to `num_workers=31` in the `DataLoader` to improve performance.
E           /home/ollie/miniconda3/envs/ptycho311/lib/python3.11/site-packages/lightning/pytorch/core/module.py:520: You called `self.log('poisson_val_loss', ..., logger=True)` but have no logger configured. You can enable one by doing `Trainer(logger=ALogger(...))`
E           /home/ollie/miniconda3/envs/ptycho311/lib/python3.11/site-packages/lightning/pytorch/trainer/connectors/data_connector.py:433: The 'train_dataloader' does not have many workers which may be a bottleneck. Consider increasing the value of the `num_workers` argument` to `num_workers=31` in the `DataLoader` to improve performance.
E           /home/ollie/miniconda3/envs/ptycho311/lib/python3.11/site-packages/lightning/pytorch/core/module.py:520: You called `self.log('poisson_train_loss', ..., logger=True)` but have no logger configured. You can enable one by doing `Trainer(logger=ALogger(...))`
E           ERROR:ptycho_torch.workflows.components:Lightning training failed: Early stopping conditioned on metric `val_loss` which is not available. Pass in or modify your `EarlyStopping` callback to use any of the following: `training_stage`, `training_stage_step`, `physics_weight`, `physics_weight_step`, `poisson_train_loss`, `poisson_train_loss_step`, `training_stage_epoch`, `physics_weight_epoch`, `poisson_val_loss`, `learning_rate`, `poisson_train_loss_epoch`
E           Traceback (most recent call last):
E             File "/home/ollie/Documents/PtychoPINN2/ptycho_torch/workflows/components.py", line 750, in _train_with_lightning
E               trainer.fit(model, train_dataloaders=train_loader, val_dataloaders=val_loader)
E             File "/home/ollie/miniconda3/envs/ptycho311/lib/python3.11/site-packages/lightning/pytorch/trainer/trainer.py", line 560, in fit
E               call._call_and_handle_interrupt(
E             File "/home/ollie/miniconda3/envs/ptycho311/lib/python3.11/site-packages/lightning/pytorch/trainer/call.py", line 49, in _call_and_handle_interrupt
E               return trainer_fn(*args, **kwargs)
E                      ^^^^^^^^^^^^^^^^^^^^^^^^^^^
E             File "/home/ollie/miniconda3/envs/ptycho311/lib/python3.11/site-packages/lightning/pytorch/trainer/trainer.py", line 598, in _fit_impl
E               self._run(model, ckpt_path=ckpt_path)
E             File "/home/ollie/miniconda3/envs/ptycho311/lib/python3.11/site-packages/lightning/pytorch/trainer/trainer.py", line 1011, in _run
E               results = self._run_stage()
E                         ^^^^^^^^^^^^^^^^^
E             File "/home/ollie/miniconda3/envs/ptycho311/lib/python3.11/site-packages/lightning/pytorch/trainer/trainer.py", line 1055, in _run_stage
E               self.fit_loop.run()
E             File "/home/ollie/miniconda3/envs/ptycho311/lib/python3.11/site-packages/lightning/pytorch/loops/fit_loop.py", line 217, in run
E               self.on_advance_end()
E             File "/home/ollie/miniconda3/envs/ptycho311/lib/python3.11/site-packages/lightning/pytorch/loops/fit_loop.py", line 473, in on_advance_end
E               call._call_callback_hooks(trainer, "on_train_epoch_end", monitoring_callbacks=True)
E             File "/home/ollie/miniconda3/envs/ptycho311/lib/python3.11/site-packages/lightning/pytorch/trainer/call.py", line 228, in _call_callback_hooks
E               fn(trainer, trainer.lightning_module, *args, **kwargs)
E             File "/home/ollie/miniconda3/envs/ptycho311/lib/python3.11/site-packages/lightning/pytorch/callbacks/early_stopping.py", line 190, in on_train_epoch_end
E               self._run_early_stopping_check(trainer)
E             File "/home/ollie/miniconda3/envs/ptycho311/lib/python3.11/site-packages/lightning/pytorch/callbacks/early_stopping.py", line 202, in _run_early_stopping_check
E               if trainer.fast_dev_run or not self._validate_condition_metric(  # disable early_stopping with fast_dev_run
E                                              ^^^^^^^^^^^^^^^^^^^^^^^^^^^^^^^^^^^^^^^^^^^^^^^^^^^^^^^^^^^^^^^^^^^^^^^^^^^^
E             File "/home/ollie/miniconda3/envs/ptycho311/lib/python3.11/site-packages/lightning/pytorch/callbacks/early_stopping.py", line 153, in _validate_condition_metric
E               raise RuntimeError(error_msg)
E           RuntimeError: Early stopping conditioned on metric `val_loss` which is not available. Pass in or modify your `EarlyStopping` callback to use any of the following: `training_stage`, `training_stage_step`, `physics_weight`, `physics_weight_step`, `poisson_train_loss`, `poisson_train_loss_step`, `training_stage_epoch`, `physics_weight_epoch`, `poisson_val_loss`, `learning_rate`, `poisson_train_loss_epoch`
E           
E           The above exception was the direct cause of the following exception:
E           
E           Traceback (most recent call last):
E             File "/home/ollie/Documents/PtychoPINN2/ptycho_torch/train.py", line 700, in cli_main
E               amplitude, phase, results = run_cdi_example_torch(
E                                           ^^^^^^^^^^^^^^^^^^^^^^
E             File "/home/ollie/Documents/PtychoPINN2/ptycho_torch/workflows/components.py", line 155, in run_cdi_example_torch
E               train_results = train_cdi_model_torch(train_data, test_data, config)
E                               ^^^^^^^^^^^^^^^^^^^^^^^^^^^^^^^^^^^^^^^^^^^^^^^^^^^^
E             File "/home/ollie/Documents/PtychoPINN2/ptycho_torch/workflows/components.py", line 1000, in train_cdi_model_torch
E               results = _train_with_lightning(train_container, test_container, config)
E                         ^^^^^^^^^^^^^^^^^^^^^^^^^^^^^^^^^^^^^^^^^^^^^^^^^^^^^^^^^^^^^^
E             File "/home/ollie/Documents/PtychoPINN2/ptycho_torch/workflows/components.py", line 753, in _train_with_lightning
E               raise RuntimeError(f"Lightning training failed. See logs for details.") from e
E           RuntimeError: Lightning training failed. See logs for details.

tests/torch/test_integration_workflow_torch.py:216: Failed
____________________ test_run_pytorch_train_save_load_infer ____________________

tmp_path = PosixPath('/tmp/pytest-of-ollie/pytest-800/test_run_pytorch_train_save_lo0')
data_file = PosixPath('/home/ollie/Documents/PtychoPINN2/tests/fixtures/pytorch_integration/minimal_dataset_v1.npz')
cuda_cpu_env = {'CLAUDECODE': '1', 'CLAUDE_CODE_ENTRYPOINT': 'sdk-cli', 'CONDA_DEFAULT_ENV': 'ptycho311', 'CONDA_EXE': '/home/ollie/miniconda3/bin/conda', ...}

    def test_run_pytorch_train_save_load_infer(tmp_path, data_file, cuda_cpu_env):
        """
        Tests the complete PyTorch train  save  load  infer workflow.
    
        This validates the PyTorch model persistence layer by simulating a real
        user workflow across separate processes, mirroring the TensorFlow integration test.
    
        Phase: C2 (GREEN)
        Behavior:
        1. Training subprocess creates Lightning checkpoint at checkpoints/last.ckpt
        2. Inference subprocess loads checkpoint and generates reconstructions
        3. Output images created in inference output directory
        4. Assertions verify artifact existence and non-empty file sizes
    
        Implementation: _run_pytorch_workflow executes train/infer via subprocess
        """
        # Execute complete workflow via subprocess helper (Phase C2 implementation)
>       result = _run_pytorch_workflow(tmp_path, data_file, cuda_cpu_env)
                 ^^^^^^^^^^^^^^^^^^^^^^^^^^^^^^^^^^^^^^^^^^^^^^^^^^^^^^^^

tests/torch/test_integration_workflow_torch.py:262: 
_ _ _ _ _ _ _ _ _ _ _ _ _ _ _ _ _ _ _ _ _ _ _ _ _ _ _ _ _ _ _ _ _ _ _ _ _ _ _ _ 

tmp_path = PosixPath('/tmp/pytest-of-ollie/pytest-800/test_run_pytorch_train_save_lo0')
data_file = PosixPath('/home/ollie/Documents/PtychoPINN2/tests/fixtures/pytorch_integration/minimal_dataset_v1.npz')
cuda_cpu_env = {'CLAUDECODE': '1', 'CLAUDE_CODE_ENTRYPOINT': 'sdk-cli', 'CONDA_DEFAULT_ENV': 'ptycho311', 'CONDA_EXE': '/home/ollie/miniconda3/bin/conda', ...}

    def _run_pytorch_workflow(tmp_path, data_file, cuda_cpu_env):
        """
        Execute PyTorch trainsaveloadinfer workflow via subprocess calls.
    
        Parameters:
            tmp_path: pytest tmp_path fixture for output directories
            data_file: Path to NPZ dataset
            cuda_cpu_env: Environment dict with CUDA_VISIBLE_DEVICES=""
    
        Returns:
            SimpleNamespace with:
                - training_output_dir: Path to training outputs
                - inference_output_dir: Path to inference outputs
                - checkpoint_path: Path to Lightning checkpoint
                - recon_amp_path: Path to amplitude reconstruction PNG
                - recon_phase_path: Path to phase reconstruction PNG
    
        Raises:
            RuntimeError: If training or inference subprocess fails
    
        Phase: C2 (GREEN)
        Implementation: Ported from legacy unittest harness with subprocess commands
        """
        from types import SimpleNamespace
    
        # Define output paths
        training_output_dir = tmp_path / "training_outputs"
        inference_output_dir = tmp_path / "pytorch_output"
    
        # --- 1. Training Step (PyTorch) ---
        # CLI parameters aligned with Phase B1 scope (fixture n_subset=64, deterministic config)
        # Preserves CONFIG-001 ordering per docs/workflows/pytorch.md 12
        train_command = [
            sys.executable, "-m", "ptycho_torch.train",
            "--train_data_file", str(data_file),
            "--test_data_file", str(data_file),
            "--output_dir", str(training_output_dir),
            "--max_epochs", "2",  # Aligned with Phase B1 runtime budget (<45s)
            "--n_images", "64",   # Matches fixture subset size
            "--gridsize", "1",
            "--batch_size", "4",
            "--device", "cpu",    # Deterministic CPU-only execution per cuda_cpu_env fixture
            "--disable_mlflow",
        ]
    
        train_result = subprocess.run(
            train_command,
            capture_output=True,
            text=True,
            env=cuda_cpu_env,
            check=False
        )
    
        if train_result.returncode != 0:
>           raise RuntimeError(
                f"PyTorch training failed with return code {train_result.returncode}\n"
                f"STDOUT:\n{train_result.stdout}\n"
                f"STDERR:\n{train_result.stderr}"
            )
E           RuntimeError: PyTorch training failed with return code 1
E           STDOUT:
E           No GPU found, using CPU instead.
E           Using new CLI interface with factory-based config (ADR-003)
E           Creating configuration via factory (CONFIG-001 compliance)...
E            Factory created configs: N=64, gridsize=(1, 1), epochs=2
E            Execution config: accelerator=cpu, deterministic=True, learning_rate=0.001
E           Starting training with 2 epochs...
E           diff3d shape: (64, 64, 64)
E           probeGuess shape: (64, 64)
E           scan_index shape: (64,)
E           objectGuess shape: (227, 226)
E           xcoords shape: (64,)
E           ycoords shape: (64,)
E           xcoords_start shape: (64,)
E           ycoords_start shape: (64,)
E           diff3d shape: (64, 64, 64)
E           probeGuess shape: (64, 64)
E           scan_index shape: (64,)
E           objectGuess shape: (227, 226)
E           xcoords shape: (64,)
E           ycoords shape: (64,)
E           xcoords_start shape: (64,)
E           ycoords_start shape: (64,)
E           diff3d shape: (64, 64, 64)
E           probeGuess shape: (64, 64)
E           scan_index shape: (64,)
E           objectGuess shape: (227, 226)
E           xcoords shape: (64,)
E           ycoords shape: (64,)
E           xcoords_start shape: (64,)
E           ycoords_start shape: (64,)
E           DEBUG: nsamples: 64, gridsize: 1 (using efficient random sample-then-group strategy)
E           INFO: 'Y' array not found. Generating ground truth patches from 'objectGuess' as a fallback.
E           neighbor-sampled diffraction shape (64, 64, 64, 1)
E           diff3d shape: (64, 64, 64)
E           probeGuess shape: (64, 64)
E           scan_index shape: (64,)
E           objectGuess shape: (227, 226)
E           xcoords shape: (64,)
E           ycoords shape: (64,)
E           xcoords_start shape: (64,)
E           ycoords_start shape: (64,)
E           DEBUG: nsamples: 64, gridsize: 1 (using efficient random sample-then-group strategy)
E           INFO: 'Y' array not found. Generating ground truth patches from 'objectGuess' as a fallback.
E           neighbor-sampled diffraction shape (64, 64, 64, 1)
E           Decoder Block 1: No attention module added.
E           Decoder Block 2: No attention module added.
E           Decoder Block 1: No attention module added.
E           Decoder Block 2: No attention module added.
E           Training failed: Lightning training failed. See logs for details.
E           
E           STDERR:
E           2025-10-23 01:19:05.870487: E external/local_xla/xla/stream_executor/cuda/cuda_fft.cc:467] Unable to register cuFFT factory: Attempting to register factory for plugin cuFFT when one has already been registered
E           WARNING: All log messages before absl::InitializeLog() is called are written to STDERR
E           E0000 00:00:1761207545.881503 2446352 cuda_dnn.cc:8579] Unable to register cuDNN factory: Attempting to register factory for plugin cuDNN when one has already been registered
E           E0000 00:00:1761207545.885142 2446352 cuda_blas.cc:1407] Unable to register cuBLAS factory: Attempting to register factory for plugin cuBLAS when one has already been registered
E           W0000 00:00:1761207545.895522 2446352 computation_placer.cc:177] computation placer already registered. Please check linkage and avoid linking the same target more than once.
E           W0000 00:00:1761207545.895533 2446352 computation_placer.cc:177] computation placer already registered. Please check linkage and avoid linking the same target more than once.
E           W0000 00:00:1761207545.895535 2446352 computation_placer.cc:177] computation placer already registered. Please check linkage and avoid linking the same target more than once.
E           W0000 00:00:1761207545.895536 2446352 computation_placer.cc:177] computation placer already registered. Please check linkage and avoid linking the same target more than once.
E           2025-10-23 01:19:07.881971: E external/local_xla/xla/stream_executor/cuda/cuda_platform.cc:51] failed call to cuInit: INTERNAL: CUDA error: Failed call to cuInit: CUDA_ERROR_NO_DEVICE: no CUDA-capable device is detected
E           2025-10-23 01:19:07.882035: E external/local_xla/xla/stream_executor/cuda/cuda_diagnostics.cc:294] kernel version 570.172.8 does not match DSO version 570.195.3 -- cannot find working devices in this configuration
E           /home/ollie/Documents/PtychoPINN2/ptycho_torch/config_factory.py:611: UserWarning: params.cfg already populated. Set force=True to overwrite existing values.
E             warnings.warn(
E           WARNING: All log messages before absl::InitializeLog() is called are written to STDERR
E           I0000 00:00:1761207550.365860 2446352 service.cc:152] XLA service 0x33f0a350 initialized for platform Host (this does not guarantee that XLA will be used). Devices:
E           I0000 00:00:1761207550.365884 2446352 service.cc:160]   StreamExecutor device (0): Host, Default Version
E           I0000 00:00:1761207550.482991 2446352 device_compiler.h:188] Compiled cluster using XLA!  This line is logged at most once for the lifetime of the process.
E           /home/ollie/Documents/PtychoPINN2/ptycho_torch/config_factory.py:257: UserWarning: test_data_file not provided in TrainingConfig overrides. Evaluation workflows require test_data_file to be set during inference update. Consider providing: overrides=dict(..., test_data_file=Path('test.npz'))
E             tf_training_config = to_training_config(
E           Seed set to 42
E           INFO:pytorch_lightning.utilities.rank_zero:GPU available: False, used: False
E           INFO:pytorch_lightning.utilities.rank_zero:TPU available: False, using: 0 TPU cores
E           INFO:pytorch_lightning.utilities.rank_zero:HPU available: False, using: 0 HPUs
E           
E             | Name  | Type        | Params | Mode 
E           ----------------------------------------------
E           0 | model | PtychoPINN  | 2.3 M  | train
E           1 | Loss  | PoissonLoss | 0      | train
E           ----------------------------------------------
E           2.3 M     Trainable params
E           0         Non-trainable params
E           2.3 M     Total params
E           9.345     Total estimated model params size (MB)
E           73        Modules in train mode
E           0         Modules in eval mode
E           /home/ollie/miniconda3/envs/ptycho311/lib/python3.11/site-packages/lightning/pytorch/trainer/connectors/data_connector.py:433: The 'val_dataloader' does not have many workers which may be a bottleneck. Consider increasing the value of the `num_workers` argument` to `num_workers=31` in the `DataLoader` to improve performance.
E           /home/ollie/miniconda3/envs/ptycho311/lib/python3.11/site-packages/lightning/pytorch/core/module.py:520: You called `self.log('poisson_val_loss', ..., logger=True)` but have no logger configured. You can enable one by doing `Trainer(logger=ALogger(...))`
E           /home/ollie/miniconda3/envs/ptycho311/lib/python3.11/site-packages/lightning/pytorch/trainer/connectors/data_connector.py:433: The 'train_dataloader' does not have many workers which may be a bottleneck. Consider increasing the value of the `num_workers` argument` to `num_workers=31` in the `DataLoader` to improve performance.
E           /home/ollie/miniconda3/envs/ptycho311/lib/python3.11/site-packages/lightning/pytorch/core/module.py:520: You called `self.log('poisson_train_loss', ..., logger=True)` but have no logger configured. You can enable one by doing `Trainer(logger=ALogger(...))`
E           ERROR:ptycho_torch.workflows.components:Lightning training failed: Early stopping conditioned on metric `val_loss` which is not available. Pass in or modify your `EarlyStopping` callback to use any of the following: `training_stage`, `training_stage_step`, `physics_weight`, `physics_weight_step`, `poisson_train_loss`, `poisson_train_loss_step`, `training_stage_epoch`, `physics_weight_epoch`, `poisson_val_loss`, `learning_rate`, `poisson_train_loss_epoch`
E           Traceback (most recent call last):
E             File "/home/ollie/Documents/PtychoPINN2/ptycho_torch/workflows/components.py", line 750, in _train_with_lightning
E               trainer.fit(model, train_dataloaders=train_loader, val_dataloaders=val_loader)
E             File "/home/ollie/miniconda3/envs/ptycho311/lib/python3.11/site-packages/lightning/pytorch/trainer/trainer.py", line 560, in fit
E               call._call_and_handle_interrupt(
E             File "/home/ollie/miniconda3/envs/ptycho311/lib/python3.11/site-packages/lightning/pytorch/trainer/call.py", line 49, in _call_and_handle_interrupt
E               return trainer_fn(*args, **kwargs)
E                      ^^^^^^^^^^^^^^^^^^^^^^^^^^^
E             File "/home/ollie/miniconda3/envs/ptycho311/lib/python3.11/site-packages/lightning/pytorch/trainer/trainer.py", line 598, in _fit_impl
E               self._run(model, ckpt_path=ckpt_path)
E             File "/home/ollie/miniconda3/envs/ptycho311/lib/python3.11/site-packages/lightning/pytorch/trainer/trainer.py", line 1011, in _run
E               results = self._run_stage()
E                         ^^^^^^^^^^^^^^^^^
E             File "/home/ollie/miniconda3/envs/ptycho311/lib/python3.11/site-packages/lightning/pytorch/trainer/trainer.py", line 1055, in _run_stage
E               self.fit_loop.run()
E             File "/home/ollie/miniconda3/envs/ptycho311/lib/python3.11/site-packages/lightning/pytorch/loops/fit_loop.py", line 217, in run
E               self.on_advance_end()
E             File "/home/ollie/miniconda3/envs/ptycho311/lib/python3.11/site-packages/lightning/pytorch/loops/fit_loop.py", line 473, in on_advance_end
E               call._call_callback_hooks(trainer, "on_train_epoch_end", monitoring_callbacks=True)
E             File "/home/ollie/miniconda3/envs/ptycho311/lib/python3.11/site-packages/lightning/pytorch/trainer/call.py", line 228, in _call_callback_hooks
E               fn(trainer, trainer.lightning_module, *args, **kwargs)
E             File "/home/ollie/miniconda3/envs/ptycho311/lib/python3.11/site-packages/lightning/pytorch/callbacks/early_stopping.py", line 190, in on_train_epoch_end
E               self._run_early_stopping_check(trainer)
E             File "/home/ollie/miniconda3/envs/ptycho311/lib/python3.11/site-packages/lightning/pytorch/callbacks/early_stopping.py", line 202, in _run_early_stopping_check
E               if trainer.fast_dev_run or not self._validate_condition_metric(  # disable early_stopping with fast_dev_run
E                                              ^^^^^^^^^^^^^^^^^^^^^^^^^^^^^^^^^^^^^^^^^^^^^^^^^^^^^^^^^^^^^^^^^^^^^^^^^^^^
E             File "/home/ollie/miniconda3/envs/ptycho311/lib/python3.11/site-packages/lightning/pytorch/callbacks/early_stopping.py", line 153, in _validate_condition_metric
E               raise RuntimeError(error_msg)
E           RuntimeError: Early stopping conditioned on metric `val_loss` which is not available. Pass in or modify your `EarlyStopping` callback to use any of the following: `training_stage`, `training_stage_step`, `physics_weight`, `physics_weight_step`, `poisson_train_loss`, `poisson_train_loss_step`, `training_stage_epoch`, `physics_weight_epoch`, `poisson_val_loss`, `learning_rate`, `poisson_train_loss_epoch`
E           
E           The above exception was the direct cause of the following exception:
E           
E           Traceback (most recent call last):
E             File "/home/ollie/Documents/PtychoPINN2/ptycho_torch/train.py", line 700, in cli_main
E               amplitude, phase, results = run_cdi_example_torch(
E                                           ^^^^^^^^^^^^^^^^^^^^^^
E             File "/home/ollie/Documents/PtychoPINN2/ptycho_torch/workflows/components.py", line 155, in run_cdi_example_torch
E               train_results = train_cdi_model_torch(train_data, test_data, config)
E                               ^^^^^^^^^^^^^^^^^^^^^^^^^^^^^^^^^^^^^^^^^^^^^^^^^^^^
E             File "/home/ollie/Documents/PtychoPINN2/ptycho_torch/workflows/components.py", line 1000, in train_cdi_model_torch
E               results = _train_with_lightning(train_container, test_container, config)
E                         ^^^^^^^^^^^^^^^^^^^^^^^^^^^^^^^^^^^^^^^^^^^^^^^^^^^^^^^^^^^^^^
E             File "/home/ollie/Documents/PtychoPINN2/ptycho_torch/workflows/components.py", line 753, in _train_with_lightning
E               raise RuntimeError(f"Lightning training failed. See logs for details.") from e
E           RuntimeError: Lightning training failed. See logs for details.

tests/torch/test_integration_workflow_torch.py:120: RuntimeError
=============================== warnings summary ===============================
tests/torch/test_cli_train_torch.py::TestExecutionConfigCLI::test_num_workers_flag_roundtrip
  /home/ollie/Documents/PtychoPINN2/ptycho_torch/train.py:636: UserWarning: Deterministic mode with num_workers=4 may cause performance degradation. Consider setting --num-workers 0 for reproducibility.
    execution_config = build_execution_config_from_args(args, mode='training')

tests/torch/test_cli_train_torch.py::TestExecutionConfigCLI::test_bundle_persistence
  /home/ollie/Documents/PtychoPINN2/ptycho_torch/config_factory.py:550: UserWarning: Error reading probeGuess from /tmp/pytest-of-ollie/pytest-800/test_bundle_persistence0/train.npz: No data left in file. Using fallback N=64.
    warnings.warn(

tests/torch/test_cli_train_torch.py: 1 warning
tests/torch/test_config_factory.py: 20 warnings
tests/torch/test_workflows_components.py: 9 warnings
  /home/ollie/Documents/PtychoPINN2/ptycho_torch/config_factory.py:257: UserWarning: test_data_file not provided in TrainingConfig overrides. Evaluation workflows require test_data_file to be set during inference update. Consider providing: overrides=dict(..., test_data_file=Path('test.npz'))
    tf_training_config = to_training_config(

tests/torch/test_cli_train_torch.py: 1 warning
tests/torch/test_config_factory.py: 23 warnings
tests/torch/test_workflows_components.py: 9 warnings
  /home/ollie/Documents/PtychoPINN2/ptycho_torch/config_factory.py:611: UserWarning: params.cfg already populated. Set force=True to overwrite existing values.
    warnings.warn(

tests/torch/test_config_bridge.py::TestConfigBridgeMVP::test_mvp_config_bridge_populates_params_cfg
  /home/ollie/Documents/PtychoPINN2/tests/torch/test_config_bridge.py:100: UserWarning: test_data_file not provided in TrainingConfig overrides. Evaluation workflows require test_data_file to be set during inference update. Consider providing: overrides=dict(..., test_data_file=Path('test.npz'))
    spec_train = config_bridge.to_training_config(

tests/torch/test_config_bridge.py::TestConfigBridgeParity::test_training_config_direct_fields[batch_size-direct]
  /home/ollie/Documents/PtychoPINN2/tests/torch/test_config_bridge.py:235: UserWarning: test_data_file not provided in TrainingConfig overrides. Evaluation workflows require test_data_file to be set during inference update. Consider providing: overrides=dict(..., test_data_file=Path('test.npz'))
    tf_train = config_bridge.to_training_config(

tests/torch/test_config_bridge.py::TestConfigBridgeParity::test_training_config_transform_fields[nepochs-rename]
tests/torch/test_config_bridge.py::TestConfigBridgeParity::test_training_config_transform_fields[nll_weight-true]
tests/torch/test_config_bridge.py::TestConfigBridgeParity::test_training_config_transform_fields[nll_weight-false]
  /home/ollie/Documents/PtychoPINN2/tests/torch/test_config_bridge.py:298: UserWarning: test_data_file not provided in TrainingConfig overrides. Evaluation workflows require test_data_file to be set during inference update. Consider providing: overrides=dict(..., test_data_file=Path('test.npz'))
    tf_train = config_bridge.to_training_config(

tests/torch/test_config_bridge.py::TestConfigBridgeParity::test_training_config_override_fields[mae_weight-default]
tests/torch/test_config_bridge.py::TestConfigBridgeParity::test_training_config_override_fields[mae_weight-override]
tests/torch/test_config_bridge.py::TestConfigBridgeParity::test_training_config_override_fields[realspace_mae_weight-default]
tests/torch/test_config_bridge.py::TestConfigBridgeParity::test_training_config_override_fields[realspace_weight-default]
tests/torch/test_config_bridge.py::TestConfigBridgeParity::test_training_config_override_fields[positions_provided-default]
tests/torch/test_config_bridge.py::TestConfigBridgeParity::test_training_config_override_fields[probe_trainable-default]
tests/torch/test_config_bridge.py::TestConfigBridgeParity::test_training_config_override_fields[sequential_sampling-default]
  /home/ollie/Documents/PtychoPINN2/tests/torch/test_config_bridge.py:366: UserWarning: test_data_file not provided in TrainingConfig overrides. Evaluation workflows require test_data_file to be set during inference update. Consider providing: overrides=dict(..., test_data_file=Path('test.npz'))
    tf_train = config_bridge.to_training_config(

tests/torch/test_config_bridge.py::TestConfigBridgeParity::test_default_divergence_detection[nphotons-divergence]
  /home/ollie/Documents/PtychoPINN2/tests/torch/test_config_bridge.py:493: UserWarning: test_data_file not provided in TrainingConfig overrides. Evaluation workflows require test_data_file to be set during inference update. Consider providing: overrides=dict(..., test_data_file=Path('test.npz'))
    tf_train = config_bridge.to_training_config(

tests/torch/test_config_bridge.py::TestConfigBridgeParity::test_train_data_file_required_error
  /home/ollie/Documents/PtychoPINN2/tests/torch/test_config_bridge.py:575: UserWarning: test_data_file not provided in TrainingConfig overrides. Evaluation workflows require test_data_file to be set during inference update. Consider providing: overrides=dict(..., test_data_file=Path('test.npz'))
    config_bridge.to_training_config(

tests/torch/test_config_bridge.py::TestConfigBridgeParity::test_nphotons_override_passes_validation
  /home/ollie/Documents/PtychoPINN2/tests/torch/test_config_bridge.py:666: UserWarning: test_data_file not provided in TrainingConfig overrides. Evaluation workflows require test_data_file to be set during inference update. Consider providing: overrides=dict(..., test_data_file=Path('test.npz'))
    tf_train = config_bridge.to_training_config(

tests/torch/test_config_bridge.py::TestConfigBridgeParity::test_training_config_n_subsample_missing_override_uses_none
  /home/ollie/Documents/PtychoPINN2/tests/torch/test_config_bridge.py:707: UserWarning: test_data_file not provided in TrainingConfig overrides. Evaluation workflows require test_data_file to be set during inference update. Consider providing: overrides=dict(..., test_data_file=Path('test.npz'))
    tf_train = config_bridge.to_training_config(

tests/torch/test_config_bridge.py::TestConfigBridgeParity::test_training_config_n_subsample_explicit_override
  /home/ollie/Documents/PtychoPINN2/tests/torch/test_config_bridge.py:742: UserWarning: test_data_file not provided in TrainingConfig overrides. Evaluation workflows require test_data_file to be set during inference update. Consider providing: overrides=dict(..., test_data_file=Path('test.npz'))
    tf_train = config_bridge.to_training_config(

tests/torch/test_config_factory.py::TestProbeSizeInference::test_infer_probe_size_missing_file_fallback
  /home/ollie/Documents/PtychoPINN2/ptycho_torch/config_factory.py:544: UserWarning: Data file /nonexistent/data.npz not found. Using fallback N=64.
    warnings.warn(

tests/torch/test_workflows_components.py::TestWorkflowsComponentsTraining::test_lightning_poisson_count_contract
  /home/ollie/miniconda3/envs/ptycho311/lib/python3.11/site-packages/lightning/pytorch/core/module.py:449: You are trying to `self.log()` but the `self.trainer` reference is not registered on the model yet. This is most likely because the model hasn't been passed to the `Trainer`

tests/torch/test_workflows_components.py::TestWorkflowsComponentsTraining::test_lightning_training_respects_gridsize
tests/torch/test_workflows_components.py::TestTrainWithLightningRed::test_train_with_lightning_instantiates_module
  /home/ollie/miniconda3/envs/ptycho311/lib/python3.11/site-packages/lightning/pytorch/callbacks/model_checkpoint.py:751: Checkpoint directory /home/ollie/Documents/PtychoPINN2/training_outputs/checkpoints exists and is not empty.

tests/torch/test_workflows_components.py::TestWorkflowsComponentsTraining::test_lightning_training_respects_gridsize
tests/torch/test_workflows_components.py::TestTrainWithLightningRed::test_train_with_lightning_instantiates_module
  /home/ollie/miniconda3/envs/ptycho311/lib/python3.11/site-packages/lightning/pytorch/trainer/connectors/data_connector.py:433: The 'train_dataloader' does not have many workers which may be a bottleneck. Consider increasing the value of the `num_workers` argument` to `num_workers=31` in the `DataLoader` to improve performance.

tests/torch/test_workflows_components.py::TestWorkflowsComponentsTraining::test_lightning_training_respects_gridsize
  /home/ollie/miniconda3/envs/ptycho311/lib/python3.11/site-packages/lightning/pytorch/callbacks/model_checkpoint.py:467: `ModelCheckpoint(monitor='train_loss')` could not find the monitored key in the returned metrics: ['epoch', 'step']. HINT: Did you call `log('train_loss', value)` in the `LightningModule`?

-- Docs: https://docs.pytest.org/en/stable/how-to/capture-warnings.html
=========================== short test summary info ============================
SKIPPED [1] tests/test_benchmark_throughput.py:11: scripts/benchmark_inference_throughput.py not found. This is a pre-existing broken test dependency. Add to fix_plan.md for future resolution.
SKIPPED [1] tests/test_run_baseline.py:4: tests/test_utilities.py not found. This is a pre-existing broken test dependency. Add to fix_plan.md for future resolution.
SKIPPED [1] tests/test_generic_loader.py:46: Data loading failed:
SKIPPED [1] tests/test_integration_baseline_gs2.py:27: Test data not found at /home/ollie/Documents/PtychoPINN2/datasets/fly/fly001_transposed.npz
SKIPPED [1] ../../miniconda3/envs/ptycho311/lib/python3.11/site-packages/_pytest/unittest.py:385: Deprecated: generate_simulated_data API changed from (obj,probe,nimages) to (config,obj,probe) and memoization disabled
SKIPPED [1] tests/test_tf_helper.py:199: TensorFlow Addons removed in TF 2.19 migration
SKIPPED [1] tests/test_tf_helper_edge_aware.py:47: tensorflow_addons not available
SKIPPED [1] tests/test_tf_helper_edge_aware.py:86: tensorflow_addons not available
SKIPPED [1] tests/test_tf_helper_edge_aware.py:198: tensorflow_addons not available
SKIPPED [1] tests/test_tf_helper_edge_aware.py:169: tensorflow_addons not available
SKIPPED [1] tests/test_tf_helper_edge_aware.py:257: tensorflow_addons not available
SKIPPED [1] tests/test_tf_helper_edge_aware.py:227: tensorflow_addons not available
SKIPPED [2] tests/torch/test_integration_workflow_torch.py: Migrated to pytest-native test_run_pytorch_train_save_load_infer
SKIPPED [1] tests/torch/test_tf_helper.py:64: torch tf_helper module not available
SKIPPED [1] tests/torch/test_tf_helper.py:57: torch tf_helper module not available
SKIPPED [1] tests/torch/test_tf_helper.py:74: torch tf_helper module not available - tests would fail
FAILED tests/torch/test_integration_workflow_torch.py::test_bundle_loader_returns_modules
FAILED tests/torch/test_integration_workflow_torch.py::test_run_pytorch_train_save_load_infer
====== 2 failed, 331 passed, 17 skipped, 89 warnings in 195.40s (0:03:15) ======
